,Date,Year,Type,Country,Location,Activity,Sex,Age,Injury,Fatal (Y/N),Time,Species
1124,25-May-2009,2009,Provoked,USA,"Clearwater Beach, Pinellas County",Swimming,M,,Right foot bitten,N,20h30,5' to 8' shark
1125,17-May-2009,2009,Unprovoked,USA,"New Smyrna Beach, Volusia County",Surfing,M,31,Lacerations to left leg & foot,N,09h35,blacktip or spinner shark
1126,16-May-2009,2009,Unprovoked,USA,"New Smyrna Beach, Volusia County",Surfing,M,49,Lacerations to right foot,N,10h27,blacktip or spinner shark
1127,16-May-2009,2009,Unprovoked,USA,"New Smyrna Beach, Volusia County",Surfing,M,55,Lacerations to right hand,N,10h16,blacktip or spinner shark
1128,12-May-2009,2009,Provoked,GUAM,Ritidian Point,Spearfishing,M,27,Speared shark bit his forearm PROVOKED INCIDENT,N,Afternoon,"Blacktip shark, 4'"
1132,21-Apr-2009,2009,Unprovoked,USA,"New Smyrna Beach, Volusia County",Surfing,M,20,3 puncture wounds to posterior right ankle,N,Late afternoon,
1133,20-Apr-2009,2009,Unprovoked,PHILIPPINES,Mabini,Swimming,M,23,Legs bitten,N,0500,
1134,19-Apr-2009,2009,Unprovoked,USA,"Carlin Park, Jupiter Inlet",Surfing,M,52,Left foot bitten,N,16h00,
1135,17-Apr-2009,2009,Unprovoked,USA,"Walton Rocks, St Lucie County",Surfing,M,31,Laceration to forearm,N,13h15,2' to 3' shark
1137,12-Apr-2009,2009,Unprovoked,AUSTRALIA,Fingal Bay,Surf skiing ,M,40,"No injury, catapulted into the water & ski damage",N,08h00,2' to 3' shark
1138,06-Apr-2009,2009,Invalid,SOUTH AFRICA,Umtentweni,Swimming,M,24,Body not recovered,,Morning,Shark involvement not confirmed
1139,06-Apr-2009,2009,Unprovoked,USA,San Diego County,Spearfishing,M,,Shark struck him but the diver was not injured,N,07h45,"White shark, 12' to 15' female"
1140,03-Apr-2009,2009,Unprovoked,USA,"Sanibel Island, Lee County",Wading,M,15,Lacerations to right foot and ankle,N,16h00,
1141,27-Mar-2009,2009,Provoked,SOUTH AFRICA,2-3 km north of Sunday's River mouth,Fishing ,M,59,Calf bitten while helping angler measure the shark during fishing competition PROVOKED INCIDENT,N,,Raggedtooth shark
1142,21-Mar-2009,2009,Unprovoked,SOUTH AFRICA,"Second Beach, Port St. John's",Surfing,M,16,FATAL,Y,Afternoon,
1143,20-Mar-2009,2009,Unprovoked,AUSTRALIA,Blue Bay,Surfing,M,17,"Laceration to right foot, puncture wounds to calf",N,18h45,Bronze whaler shark?
1146,18-Mar-2009,2009,Unprovoked,USA,"Ponce Inlet, Volusia County",Surfing,F,17,Minor bite to ankle,N,17h30,3' to 4' shark
1148,17-Mar-2009,2009,Unprovoked,USA,Alenuihaha Channel,Swimming,M,61,"Minor injury, bite chest and left calf",N,20h00,Thought to involve a cookie cutter shark
1149,Reported 16-Mar-2009,2009,Provoked,AUSTRALIA,"The Natural Jetty, Rottnest Island",Wading,M,21,Thigh bitten when he trod on the shark PROVOKED INCIDENT,N,,"Wobbegong shark, 60cm"
1150,06-Mar-2009,2009,Unprovoked,NEW CALEDONIA,Bourail,Surfing,M,19,FATAL,Y,11h30,
1151,02-Mar-2009,2009,Provoked,SOUTH AFRICA,Off Cape Point,Fishing,M,40,Lacerations to arm and 2 fingers by hooked shark PROVOKED INCIDENT,N,13h30,"Blue shark, 1m"
1153,01-Mar-2009,2009,Unprovoked,AUSTRALIA,Avalon,Surfing,M,15,Lacerations to leg,N,06h45,2.6 m shark
1156,12-Feb-2009,2009,Unprovoked,AUSTRALIA,"Bondi Beach, Sydney",Surfing,M,33,Severe injury to hand ,N,19h30,"White shark, 2.5m "
1157,11-Feb-2009,2009,Unprovoked,AUSTRALIA,"Garden Point, Woolloomooloo Sydney Harbour","Diving, but on the surface when bitten by the shark",M,31,Severe injuries to right hand & right thigh. Right hand  surgically amputated & his right leg a week later,N,Before 07h00,"Bull shark, 2.7 m "
1159,07-Feb-2009,2009,Unprovoked,AUSTRALIA,Cellito Beach,Surfing,M,41,"No injury, surfboard dented",N,11h00,"White shark, 12' "
1163,25-Jan-2009,2009,Unprovoked,CUBA,Guantanamo Bay,Spearfishing,M,15,Severe lacerations to lower left leg,N,10h30,Bull shark
1165,24-Jan-2009,2009,Unprovoked,AUSTRALIA,"Surf Beach, Batemans Bay",Swimming,M,19,Hand injured,N,16h30,
1166,24-Jan-2009,2009,Unprovoked,SOUTH AFRICA,"Second Beach, Port St. John's",Swimming,M,25,FATAL,Y,14h00,Tiger shark
1168,18-Jan-2009,2009,Boat,AUSTRALIA,Off Tower Hill,Fishing,M,,"No injury to occupants, shark bit propeller",N,09h20,"White shark, 5.5 m "
1171,12-Jan-2009,2009,Unprovoked,AUSTRALIA,"Windang,       Lake Illawara",Snorkeling,M,24,Puncture wounds to right calf,N,10h45,"Dusky shark, 2m"
1172,11-Jan-2009,2009,Unprovoked,AUSTRALIA,Binalong Bay,Surfing,F,13,Severe lacerations to right leg,N,15h45,"White shark, 5m"
1173,11-Jan-2009,2009,Unprovoked,AUSTRALIA,Fingal Beach,Surfing,M,31,Left thigh severely bitten,N,09h00,"White shark, 3.5m"
1176,06-Jan-2009,2009,Unprovoked,NEW ZEALAND,Haumoana ,Swimming,M,49,Posterior thigh bitten,N,17h30,Broadnose sevengill shark
1181,27-Dec-2008,2008,Boating,AUSTRALIA,"Long Reef, north of Sydney",Kayaking,M,29,"No injury, shark struck kayak, catapulting him into the water",N,11h00,"White shark, 4m to 5m "
1182,27-Dec-2008,2008,Unprovoked,AUSTRALIA,Port Kennedy Beach,Snorkeling,M,51,FATAL,Y,07h00,4 to 5m white shark
1183,20-Dec-2008,2008,Boating,USA,"Dillon Beach, Marin County",Kayaking,M,,"No injury, shark struck paddle",N,15h00,White shark
1185,10-Dec-2008,2008,Provoked,SOUTH AFRICA,Plettenberg Bay,Fishing,M,15,"Lacerations to knees, thigh and hip by hooked shark PROVOKED iNCIDENT  ",N,20h00,"Raggedtooth shark, 2m"
1188,28-Nov-2008,2008,Unprovoked,EGYPT,Elphinstone Reef,Scuba diving,F,,Lacerations to fingers,N,Morning,Oceanic whitetip shark
1193,06-Nov-2008,2008,Unprovoked,PHILIPPINES,"off Paoay, Ilocos Norte Province",Fishing,M,39,Torso & righ arm bitten FATAL,Y,10h00 -- 11h00,
1194,22-Oct-2008,2008,Provoked,AUSTRALIA,"Oceanworld, Manley",Scuba diving,M,34,Small laceration to head from captive shark,N,17h20,"Grey nurse shark, 3m"
1195,21-Oct-2008,2008,Unprovoked,NEW CALEDONIA,,Spearfishing,M,24,Legs bitten,N,11h00,Lemon shark
1196,12-Oct-2008,2008,Provoked,AUSTRALIA,Darwin,Fishing,M,50,Right leg injured by hook and hooked shark PROVOKED INCIDENT,N,," reef shark, 1.8m"
1197,11-Oct-2008,2008,Unprovoked,AUSTRALIA,Lake Macquarie,Surfing,M,15,"No injury, board damaged",N,15h30,
1198,08-Oct-2008,2008,Unprovoked,USA,"Santa Rosa Beach, Walton County",Fishing,M,11,Lacerations,N,12h00,
1199,06-Oct-2008,2008,Unprovoked,CROATIA,"Smokvina Bay, Vis Island",Spearfishing,M,43,Calf bitten,N,12h00,5 m white shark
1200,28-Sep-2008,2008,Unprovoked,USA,"New Smyrna Beach, Volusia County",Surfing,M,44,Small puncture wounds to the heel of left foot,N,11h45,
1201,28-Sep-2008,2008,Unprovoked,USA,Bethune Beach,Surfing,M,40,Right foot bitten,N,11h00,+3' shark
1202,15-Sep-2008,2008,Provoked,AUSTRALIA,Near Croker Island,Swimming,M,43,Right hand lacerated by netted shark PROVOKED INCIDENT,N,14h30,Bronze whaler shark
1203,14-Sep-2008,2008,Unprovoked,USA,"Ormond-by-the-Sea, Volusia County",Swimming,M,32,Lacerations to foot,N,12h00,2' to 3' juvenile shark
1204,09-Sep-2008,2008,Unprovoked,USA,"Ka'a'awa, Oahu",Surfing,M,40,Bitten on right thigh & calf,N,16h30,Tiger shark
1205,08-Sep-2008,2008,Unprovoked,USA,"Surf Beach, Lompoc, Santa Barbara County",Surfing,M,,"No injury to surfer, board bitten",N,10h30,"White shark, 14' to 16' "
1206,07-Sep-2008,2008,Unprovoked,AUSTRALIA,"Clarks Beach, Byron Bay",Surfing,M,51,Shark became tangled in his surfboard leash. The surfer was not injured,N,12h00,3 m shark
1207,06-Sep-2008,2008,Unprovoked,USA,"Ponce Inlet, New Smyrna Beach, Volusia County",Surfing,M,43,Minor injury to foot,N,12h00,
1208,06-Sep-2008,2008,Unprovoked,USA,"Ponce Inlet, New Smyrna Beach, Volusia County",Surfing,M,15,Minor injury to foot,N,12h00,
1209,01-Sep-2008,2008,Unprovoked,USA,"New Smyrna Beach, Volusia County",Surfing,M,52,Shark bumped right ankle,N,10h00,4' shark
1212,30-Aug-2008,2008,Invalid,USA,"McKenzie Beach Park in Pahoa, Hawai'i ",Swimming,M,27,Death was probably due to drowning,,19h20,Shark involvement not confirmed
1213,30-Aug-2008,2008,Provoked,ENGLAND, Lundy Island,Fishing,M,52,Wrist bitten by hooked shark PROVOKED INCIDENT,N,,Blue shark
1214,28-Aug-2008,2008,Unprovoked,USA,"New Smyrna Beach, Volusia County",Surfing,M,19,Superfical cut to left ankle,N,12h00,
1215,27-Aug-2008,2008,Unprovoked,USA,"New Smyrna Beach, Volusia County",Surfing,M,26,Lacerations to lower left leg,N,11h00,6' shark
1216,24-Aug-2008,2008,Unprovoked,USA,"New Smyrna Beach, Volusia County","Swimming, towing surfboard",M,20,Minor injury to left foot,N,15h00,
1217,24-Aug-2008,2008,Invalid,USA,"Surf City, Topsail Island, Pender County",Surfing,F,20,Calf bitten,,18h00,Shark involvement not confirmed
1218,20-Aug-2008,2008,Unprovoked,USA,"Sanibel Island, Lee County",Swimming,M,47,3 lacerations to forearm,N,14h45,
1220,16-Aug-2008,2008,Unprovoked,USA,Buck Island,Treading water,F,38,Severe lacerations to left foot,N,Dusk,8' bull shark or Caribbean reef shark
1221,12-Aug-2008,2008,Unprovoked,USA,"New Smyrna Beach, Volusia County",Wading,F,13,Puncture wounds & 3-inch laceration to right calf,N,12h05,
1222,11-Aug-2008,2008,Unprovoked,USA,"Ala Moana Beach Park, Oah'u",Diving,M,,"No injury, shark grabbed his bag of fish",N,14h00,"Tiger shark, 12'"
1223,30-Jul-2008,2008,Unprovoked,AUSTRALIA,Levys Beach,Surfing,M,31,"No injury, surfboard leash severed",N,10h30,8' white shark or 7-gill shark
1225,27-Jul-2008,2008,Unprovoked,PANAMA,Playa Teta,Swimming or surfing,M,,5 lacerations to left foot,N,18h00,3'  shark
1227,26-Jul-2008,2008,Unprovoked,USA,"Honokowai, Maui",Swimming,M,,Minor injury,N,15h30,2' to 3' reef shark
1228,25-Jul-2008,2008,Unprovoked,USA,"New Smyrna Beach, Volusia County",Surfing,M,17,Right foot bitten,N,09h00,
1229,25-Jul-2008,2008,Unprovoked,USA,"Lahilahi Point, Oahu",Snorkeling,F,44,Forearm bitten ,N,08h45,
1230,24-Jul-2008,2008,Unprovoked,USA,"Surf City, Topsail Island, Pender County",Wading,M,9,Minor lacerations to  toe,N,,3' shark
1231,24-Jul-2008,2008,Unprovoked,USA,"Topsail Island, Pender County",Wading,F,8,Lacerations to dorsum of right foot ,N,13h00,3' to 4' shark
1232,23-Jul-2008,2008,Provoked,USA,"New Smyrna Beach, Volusia County",Surfing,M,15,Foot bitten after he stepped on the shark PROVOKED INCIDENT,N,14h30,
1233,19-Jul-2008,2008,Unprovoked,USA,"New Smyrna Beach, Volusia County",Wading,M,16,Lacerations to lower left leg,N,13h55,4' shark
1236,11-Jul-2008,2008,Unprovoked,USA,"Isle of Palms, Charleston County",Surfing,M,24,Laceration to foream,N,14h00,
1237,09-Jul-2008,2008,Unprovoked,USA,"Emerald Isle, Carteret County",Swimming,F,14,Lacerations to  right foot,N,19h30,
1239,Late Jul-2008,2008,Boating,UNITED KINGDOM,"Rock-a-Nore, Hastings",Rowing an inflatable dinghy,M,16,Shark leapt into & damaged the dinghy but no injury to occupants,N,,"Starry smoothhound shark, 1m"
1240,28-Jun-2008,2008,Invalid,USA,"Kamilo Point, Hawai'i",Wading,M,53,Probable drowning with post-mortem bites,,Afternoon,Shark involvement prior to death not confirmed
1241,28-Jun-2008,2008,Unprovoked,BAHAMAS,,Spearfishing,M,42,Lacerations to calf,N,11h00,"Bull shark, 6' to 7'"
1242,28-Jun-2008,2008,Unprovoked,SOUTH AFRICA,Mossel Bay,Surf skiing ,M,46,"No injury, ski bitten",N,14h00,"White shark, 2m"
1244,26-Jun-2008,2008,Unprovoked,USA,"New Smyrna Beach, Volusia County",Surfing,M,29,Minor laceration to foot,N,Afternoon,
1245,26-Jun-2008,2008,Unprovoked,USA,"Isle of Palms, Charleston County",Swimming,M,37,Lacerations to hand,N,11h15,4.5 to 5' shark
1247,21-Jun-2008,2008,Boating,USA,"West Cove, Catalina Island",Kayaking,F,40," No injury. Shark bumped kayak, flinging her into the  water. ",N,09h00,"White shark, 15'"
1248,20-Jun-2008,2008,Unprovoked,USA,"Fernandina Beach, Nassau County",Wading,F,35,Lacerations to lower right calf,N,11h10,
1252,01-Jun-2008,2008,Unprovoked,USA,Cherry Grove,Body surfing,F,15,Foot bitten,N,18h30,5' shark
1253,01-Jun-2008,2008,Unprovoked,BRAZIL,"Piedade, Recife",Swimming,M,14,"Hand severed, buttocks bitten",N,15h00,Bull shark
1254,26-May-2008,2008,Unprovoked,USA,"Hammocks Beach State Park, Bear Island, Onslow County",Surfing,M,9,Biceps & lower arm bitten,N,15h50,
1256,24-May-2008,2008,Unprovoked,MEXICO,Playa Linda,Surfing,M,49,Lacerations to right forearm and hand,N,Early morning,3 m shark
1257,23-May-2008,2008,Unprovoked,MEXICO,Pantla Beach,Surfing,M,21,FATAL,Y,,2 m shark
1258,14-May-2008,2008,Unprovoked,FIJI,Turtle Island,Night diving,M,28,FATAL,Y,Night,
1259,10-May-2008,2008,Unprovoked,AUSTRALIA,Albany,Swimming,M,37,Severe lacerations to left leg,N,07h30,"White shark, 4m"
1260,07-May-2008,2008,Unprovoked,NEW CALEDONIA,Hienghène,Fishing,M,40,Lower legs bitten,N,14h00,2 small bull sharks
1261,07-May-2008,2008,Unprovoked,USA,"New Smyrna Beach, Volusia County",Wading,M,6,2 inch laceration to left lower calf.,N,Just before noon,
1263,28-Apr-2008,2008,Unprovoked,MEXICO,Troncones Beach,Surfing,M,24,FATAL    Severe bite to right thigh,Y,Afternoon,Tiger shark
1264,28-Apr-2008,2008,Unprovoked,USA,"New Smyrna Beach, Volusia County",Surfing,M,18,3-inch laceration to dorsal surface of left foot,N,11h45,4' shark
1265,27-Apr-2008,2008,Unprovoked,USA,"New Smyrna Beach, Volusia County",Surfing,M,24,Calf bitten,N,10h30,
1266,26-Apr-2008,2008,Unprovoked,NEW CALEDONIA,Poindimié,Swimming,M,32,Lacerations to left foot,N,Morning,"Bull shark, 1.8m"
1267,26-Apr-2008,2008,Provoked,USA,"New Smyrna Beach, Volusia County",Surfing,M,21,Puncture wounds to right foot                  PROVOKED INCIDENT,N,09h50,
1268,25-Apr-2008,2008,Unprovoked,USA,"Solana Beach, San Diego County",Swimming,M,66,FATAL,Y,07h00,"White shark, 12' to 15'"
1269,20-Apr-2008,2008,Unprovoked,USA,"New Smyrna Beach, Volusia County",Surfing,M,14,Cuts & punctures to right foot,N,08h45,
1272,18-Apr-2008,2008,Invalid,MEXICO,"Delfines Beach, Cancun",Swimming,M,32,Probable drowning with post-mortem bites,,Evening,"Reported by media as shark attack, but shark involvement prior to death was not confirmed"
1273,17-Apr-2008,2008,Invalid,AUSTRALIA,"Duranbah, Greenmount Beach",Surfing,M,19,2 puncture wounds to leg,,11h00,Shark involvement not confirmed; thought to be a barracuda bite
1274,15-Apr-2008,2008,Unprovoked,USA,"Playalinda Beach, Canaveral National Seashore, Brevard County",Surfing,M,30,Puncture wounds to right foot,N,15h00,1.5' to 2' shark
1276,25-Mar-2008,2008,Unprovoked,USA,"Palm Beach Shores, Palm Beach County",Wading,M,15,Shin bitten,N,,6' shark
1278,08-Apr-2008,2008,Unprovoked,AUSTRALIA,"Lighthouse Beach, Ballina",Body boarding,M,16,FATAL,Y,08h05,Bull shark
1279,03-Apr-2008,2008,Unprovoked,USA,"South of Ponce de Leon Jetty, New Smyrna Beach, Volusia County",Walking out of the water after surfing,M,18,Right foot & ankle bitten,N,12h00,
1281,28-Mar-2008,2008,Unprovoked,USA,"New Smyrna Beach / Ponce Inlet, Volusia County",Surfing,M,52,Foot bitten,N,18h50,4' to 5' shark
1283,23-Mar-2008,2008,Unprovoked,USA,"South of Ponce de Leon Jetty, New Smyrna Beach, Volusia County",Walking out of the water after surfing,M,13,Three small lacerations/ punctures to right foot,N,11h30,2.5' shark
1284,21-Mar-2008,2008,Unprovoked,USA,"Beachway Avenue Approach, New Smyrna Beach, Volusia County",Wading,M,14,Two 3-inch lacerations to right ankle,N,15h53,
1285,15-Mar-2008,2008,Unprovoked,USA,"Lovers Key State Park, Bonita Springs, Lee County",Jet skiing,M,8,Minor injury,N,Afternoon,Shark involvement not confirmed
1286,07-Mar-2008,2008,Unprovoked,USA," Huntington Beach, Orange County",Surfing,M,27,"No injury to surfer, surfboard bitten by the shark",N,08h00,White shark
1287,24-Feb-2008,2008,Unprovoked,BAHAMAS,"Dive site known as ""The End of the Map""",Diving,M,49,"Leg bitten, FATAL",Y,10h00,"A bull shark, according to some of the divers on the boat"
1289,15-Feb-2008,2008,Unprovoked,USA,"Ponce Inlet, Volusia County",Surfing,M,25,Lacerations to foot,N,17h00,
1290,07-Feb-2008,2008,Unprovoked,AUSTRALIA,Horseshoe Bay,Surfing,F,14,Abrasions to elbow; collided with shark,N,,1 m shark
1293,29-Jan-2008,2008,Unprovoked,SOUTH AFRICA,"Suncoast Pirates Beach, Durban",Surf-skiing,M,42,"No injury to surf-skiier, shark holed ski",N,,"Blacktip shark, 2m"
1294,27-Jan-2008,2008,Provoked,AUSTRALIA,200 km east of Coolangatta  ,Accidentally stood on hooked shark's tail before attempting to gut it ,M,20,Laceration to left knee PROVOKED INCIDENT,N,07h30,"Mako shark, 90kg"
1297,10-Jan-2008,2008,Unprovoked,USA,"Playalinda Beach, Canaveral National Seashore, Brevard County",Surfing,M,20,Left foot bitten,N,,a small shark
1299,Summer-2008,2008,Unprovoked,MEXICO,Playas de Tijuana,Surfing,M,26,Leg bitten,N,,Possibly a hammerhead shark
1300,21-Dec-2007,2007,Unprovoked,ECUADOR,San Cristobal Island,Surfing,M,24,Lacerations & puncture wounds  to left thigh,N,,3 m shark
1302,18-Dec-2007,2007,Unprovoked,AUSTRALIA,Jimmy's Beach,Surfing,M,31,Severe lacerations to right buttock,N,11h00,2 m shark
1303,15-Dec-2007,2007,Unprovoked,AUSTRALIA,South Stradbroke Island,Swimming,M,teen,Lacerations to hand,N,,"""a small shark"""
1304,14-Dec-2007,2007,Invalid,AUSTRALIA,Bondi ,Swimming,M,34,Lacerations to left forearm,,20h30,Not a shark attack; it was a hoax
1305,10-Dec-2007,2007,Unprovoked,USA,"Waialua Bay, O'ahu",Surfing,M,52,"No injury, shark bit surfboard ",N,"""Just before 11h00""",Tiger shark
1307,07-Dec-2007,2007,Unprovoked,BRAZIL,Itamaracá,Removing fish from a trap,M,28,20 cm injury to left foot,N,,2.27 m shark
1308,18-Nov-2007,2007,Provoked,AUSTRALIA,In a tidal creek    5 km from Wickham,Fishing,M,32,Minor injury to finger by netted shark PROVOKED INCIDENT,N,,reef shark
1310,07-Nov-2007,2007,Unprovoked,SOUTH AFRICA,The Strand,Surfing,M,14,Lacerations to feet,N,17h30,1.5 to 2 m shark
1311,06-Nov-2007,2007,Unprovoked,USA,"New Smyrna Beach, Volusia County",Surfing,M,21,Cut to right knee,N,11h115,4' to 5' shark
1312,04-Nov-2007,2007,Unprovoked,USA,"Round Island Park, Indian River County",Surfing,M,42,Lacerations to right leg,N,09h00,5' shark
1313,03-Nov-2007,2007,Unprovoked,SOUTH AFRICA,Bonza Bay,Surfing,M,37,Lacerations to thigh,N,08h45,"White shark, 3m to 4m"
1315,29-Oct-2007,2007,Unprovoked,USA,"Wailea, Maui",Floating,M,32,Lacerations to left lower leg,N,15h30,Tiger shark
1316,15-Oct-2007,2007,Unprovoked,AUSTRALIA,Byron Bay,Surf-skiing,F,52,small laceration to wrist,N,11h30,"White shark, 2.5m "
1317,13-Oct-2007,2007,Unprovoked,AUSTRALIA,Holmes Reef,Spearfishing,M,31,Laceration to calf,N,12h00,Bronze whaler shark
1318,07-Oct-2007,2007,Unprovoked,USA,"Venice Pier, Venice, Los Angeles County",Surfing,M,22,4 scratches on left hand,N,20h30,3' to 4' shark
1319,06-Oct-2007,2007,Unprovoked,USA,"Playalinda Beach, Canaveral National Seashore, Brevard County",Surfing,M,16,Severe lacerations to right hand,N,08h10,"Blacktip shark, 5'"
1322,30-Sep-2007,2007,Unprovoked,NEW CALEDONIA,"Bay of Luengoni, Lifou Island",Swimming,F,23,FATAL,Y,Early morning,Tiger shark
1323,28-Sep-2007,2007,Unprovoked,BAHAMAS,Sweetings Cay,Spearfishing,F,48,Thigh bitten,N,12h00,Caribbean reef shark
1324,27-Sep-2007,2007,Unprovoked,USA,"Moonstone Beach, Humboldt County",Surfing,F,,"No injury to surfer, surfboard bitten",N,08h15,White shark
1325,27-Sep-2007,2007,Unprovoked,EGYPT,Daedalus Reef ,Swimming,F,18 or 20,"Severe lacerations to lower left leg, ankle and foot",N,07h00,Oceanic whitetip sharks were in the vicinity
1328,20-Sep-2007,2007,Unprovoked,USA,"New Smyrna Beach, Volusia County",Surfing,M,23,Small lacerations to bottom of right big toe,N,18h20,3' shark
1329,17-Sep-2007,2007,Unprovoked,SOLOMON ISLANDS,Kicha Island,Spearfishing,M,,Left thigh bitten,N,Dusk,Gray reef shark
1330,16-Sep-2007,2007,Unprovoked,USA,"New Smyrna Beach, Volusia County",Wading?,M,56,Laceration to right heel,N,11h15,
1331,16-Sep-2007,2007,Unprovoked,USA,"Flagler Beach, Flagler County",Surfing,F,Teen,"No injury, surfboard bitten",N,Early morning,9.5' shark?
1332,13-Sep-2007,2007,Unprovoked,USA,"Lauderdale-by-the-Sea, Broward County",Snorkeling,M,14,"Minor injury, shark latched onto his abdomen",N,16h00,"Nurse shark, 2' to 3' "
1333,08-Sep-2007,2007,Unprovoked,USA,"Pepper Park Beach, St. Lucie County",Wading,F,58,Puncture wounds & 2-inch laceration to calf,N,11h45,
1334,05-Sep-2007,2007,Unprovoked,USA,"Daytona Beach, Volusia County",Wading,F,36,Laceration to right big toe,N,13h42,
1335,04-Sep-2007,2007,Unprovoked,USA,Sullivan's Island,Standing,M,15,Lacerations to left calf and both feet ,N,18h30,
1336,03-Sep-2007,2007,Unprovoked,USA,"Daytona Beach, Volusia County",Jumping,F,12,Tiny punctures to arm,N,Morning,"18"" to 24"" shark"
1337,03-Sep-2007,2007,Unprovoked,USA,"Fort Lauderdale, Broward County",Swimming,M,58,"3"" laceration to left forearm",N,09h45,Possibly a spinner shark
1338,28-Aug-2007,2007,Unprovoked,USA,"Ka'a'awa, Oahu",Body boarding,M,15,Laceration to right heel,N,16h30,"Tiger shark, 10' to 12' "
1339,28-Aug-2007,2007,Unprovoked,USA,"Marina State Beach, Monterey County",Surfing,M,24,Lacerations to thigh & torso,N,10h45,"White shark, 12'"
1340,26-Aug-2007,2007,Unprovoked,USA,"New Smyrna Beach, Volusia County",Surfing,M,54,Left hand  bitten,N,14h00,3' shark
1341,25-Aug-2007,2007,Unprovoked,USA,"New Smyrna Beach, Volusia County",Surfing,M,27, 6 lacerations to left hand,N,Morning,3' shark
1343,20-Aug-2007,2007,Provoked,USA,"Indian River Inlet, Rehoboth Beach",Fishing,M,,Forearm bitten by hooked shark PROVOKED INCIDENT,N,19h45,Sandtiger shark
1344,19-Aug-2007,2007,Unprovoked,USA,"Islamorada Founder's Park, Plantation Key, Monroe County",Swimming,M,52,Torso bitten,N,20h15,
1345,19-Aug-2007,2007,Unprovoked,USA,"New Smyrna Beach, Volusia County",Surfing,M,16,Foot bitten,N,12h39,4' to 5' shark
1346,19-Aug-2007,2007,Unprovoked,USA,"Lakewood Campground, Grand Strand, Horry County",Playing,M,7,Right calf bitten,N,10h00,
1347,15-Aug-2007,2007,Unprovoked,USA,Sarasota Bay,Floating near boat & observing bioluminesce,M,20,Puncture wounds to torso,N,Night,Possibly a 6' bull shark
1348,12-Aug-2007,2007,Unprovoked,USA,"New Smyrna Beach, Volusia County",Swimming,F,15,"Minor injury, small lacerations to right foot",N,17h35, 
1349,11-Aug-2007,2007,Unprovoked,USA,"Ponce Inlet,  New Smyrna Beach, Volusia County",Walking out of the water after surfing,M,19,"Minor injury, lacerations to left ankle & foot ",N,18h00,
1350,09-Aug-2007,2007,Unprovoked,USA,"Isle of Palms, Charleston County",Swimming,M,30,Lacerations to right foot,N,16h40,
1351,09-Aug-2007,2007,Unprovoked,USA,"Isle of Palms, Charleston County",Boogie Boarding,M,9,Lacerations to lower leg & ankle,N,14h00,
1352,07-Aug-2007,2007,Unprovoked,USA,"Islamorada, Monroe County",Jumped into the water,F,19,Lacerations to arm,N,Afternoon,Possibly a 10' bull shark
1353,29-Jul-2007,2007,Unprovoked,USA,"Ponce Inlet, Volusia County",Surfing,M,51,Minor injury to shoulder,N,Afternoon,
1354,28-Jul-2007,2007,Unprovoked,USA,"Imperial Beach, San Diego County",Surfing,M,20,"No injury, shark bit surfboard",N,23h00,
1356,21-Jul-2007,2007,Boating,USA,"Bean Hollow State Beach, San Mateo County",Kayak Fishing,M,,"No injury, kayak bitten",N,10h15,White shark
1357,19-Jul-2007.b,2007,Unprovoked,USA,"Bellows Beach near Wailea Point, Oahu",Snorkeling,M,36,Left calf severely bitten,N,15h15, 
1358,19-Jul-2007.a,2007,Unprovoked,AUSTRALIA,Direction Island,Wading,M,15,Calf bitten,N,11h00,"Bronze whaler shark, 1.5 m "
1359,18-Jul-2007,2007,Unprovoked,USA,"North Topsail Beach, Onslow  County",Swimming,M,14,Right calf bitten,N,12h30,2' to 3' shark
1360,18-Jul-2007,2007,Provoked,NORWAY,Sjøstrand,Scuba diving,M,48,PROVOKED INCIDENT           No injury. Diver touched 'dead' shark; shark bit his equipment-covered arm,N,,"3' small spotted catshark, Scyliorhinus canicula"
1361,17-Jul-2007,2007,Invalid,USA,"Faria Beach, Ventura County",Swimming,F,43,Foot injured. Shark involvment uncomfirmed,,11h00,Shark involvement not confirmed
1362,17-Jul-2007,2007,Unprovoked,USA,"Atlantic Beach, Carteret County",Wading,F,30,Lacerations to right thigh & left foot,N,13h00,5' shark
1363,10-Jul-2007,2007,Unprovoked,BAHAMAS,Allan-Pensacola Cay,Spearfishing,F,48,"Lacerations to thumb, ring and pinky fingers of right hand ",N,11h00,"Bull shark, 5' "
1364,05-Jul-2007,2007,Unprovoked,USA,"Ponce Inlet, Volusia County",Surfing,M,18,Right foot bitten,N,16h00,
1365,04-Jul-2007,2007,Unprovoked,REUNION,Boucan Canot,Body boarding,M,17,Minor injuries to thigh & knee ,N,14h30,2 m shark
1369,25-Jun-2007,2007,Unprovoked,USA,"New Smyrna Beach, Volusia County",Surfing,M,20,6 to 8 puncture wounds to right hand,N,17h30,4' shark
1370,24-Jun-2007,2007,Unprovoked,USA,"Silva's Channel, Mokuleia, O'ahu",Surfing,M,,"No injury, board damaged",N,07h05,Tiger shark
1371,17-Jun-2007,2007,Invalid,USA,"Vilano Beach, St.  Johns County",Surfing,F,9,Superficial injuries to upper leg may have been caused by surfboard fin,,16h30,Shark involvement not confirmed
1372,12-Jun-2007,2007,Unprovoked,USA,"Turtle Beach, Siesta Key, Sarasota County",Swimming,F,,Right foot bitten,N,11h00,3' to 4' shark
1375,24-May-2007,2007,Provoked,USA,"Virginia Aquarium & Marine Science Center, Virginia Beach ",Reviving a sedated shark,F,40,Left shin bitten by captive shark PROVOKED INCIDENT,N,Morning,A 10-year-old 94-pound pregnant blacktip reef shark
1376,Reported 17-May-2007,2007,Provoked,ENGLAND,Folkestone,Fishing,M,38,Bitten on the nose by a hooked shark PROVOKED INCIDENT,N,Afternoon,"Lesser spotted dogfish, Scyliorhinus canicula, less than 80 cm in length"
1377,16-May-2007,2007,Unprovoked,AUSTRALIA,"Warra Beach, Coral Bay",Wading,F,38,Left heel & calf bitten,N,14h30,2.5 m shark
1378,12-May-2007,2007,Unprovoked,AUSTRALIA,Warrnambool,Surfing,M,19,"No injury, shark's fin caught his leg",N,17h45,10' shark
1379,10-May-2007,2007,Unprovoked,USA,"New Smyrna Beach, Volusia County",Surfing,F,21,Knee bitten,N,16h00,4' to 5' shark
1381,08-May-2007,2007,Invalid,AUSTRALIA,Kingscliff Beach,Swimming,M,45,Shark involvement prior to death unconfirmed,,12h15,Shark involvement prior to death was not confirmed
1382,07-May-2007,2007,Unprovoked,USA,"Keawakapu Beach, Maui",Snorkeling,F,63,Right foot bitten,N,08h30,"Tiger shark, 14' "
1383,07-May-2007,2007,Unprovoked,USA,Naples,Swimming,M,68,Circular bite on left thigh,N,08h30,6' to 8' shark
