,Date,Year,Type,Country,Location,Activity,Sex,Age,Injury,Fatal (Y/N),Time,Species
3414,1970s,1970,Unprovoked,IRAQ,Shatt-al-Arab River,Swimming,M,35,"FATAL, left leg severed",Y,12h00,
3415,1970s,1970,Unprovoked,IRAQ,Shatt-al-Arab River,"Fishing, trying to catch the end of his fishing line",M,35,Left hand bitten,N,Afternoon,
3416,30-Nov-1969,1969,Unprovoked,AUSTRALIA,"Swan River, 13 miles upstream",Swimming,M,15,Left thigh lacerated,N,Afternoon,
3419,14-Oct-1969,1969,Unprovoked,USA,Hawaii,Diving,M,,No injury,N,Morning,Oceanic whitetip shark
3420,06-Sep-1969,1969,Unprovoked,USA,"Bird Rock, Tomales Point, near Marin County / Sonoma County border",Free diving for abalone,M,53,Leg & ankle severely bitten,N,11h20,"White shark, 4.3 m 4.9 m [14' to 16'] "
3423,02-Aug-1969,1969,Unprovoked,USA,"New Smyrna Beach, Volusia County",Surfing,M,15,Lacerations to lower leg,N,Morning,
3424,02-Aug-1969,1969,Unprovoked,USA,"St. Petersburg, Pinnellas County",Body surfing,M,13,Lacerations to right lower leg & left arm and hand,N,16h30,4' shark
3427,22-Jul-1969,1969,Provoked,USA,Florida Keys,,M,13,Scrape on head. Recorded as PROVOKED INCIDENT,N,16h00,Nurse shark
3428,20-Jul-1969,1969,Unprovoked,USA,"Pigeon Point, San Mateo County",Freediving for abalone (at surface),M,,"Foot bitten, minor injury",N,13h00,"White shark, 5 m [16.5'] "
3429,27-Jun-1969,1969,Unprovoked,USA,Florida Keys,Wading,M,22,No details,UNKNOWN,1600,
3430,12-Jun-1969,1969,Unprovoked,JAMAICA,Off Rocky Point,Diving,M,27,Multiple lacerations,N,Morning,
3431,Jun-1969,1969,Unprovoked,USA,Sarasota County,Wading,M,8,No injury,N,20h00,
3432,25-May-1969,1969,Provoked,USA,Packery Channel,Surf-fishing,M,,Foot lacerated when he stepped on the shark  PROVOKED INCIDENT,N,19h00,2' to 3' shark
3433,24-May-1969,1969,Provoked,USA,Sarasota County,Diving,M,23,Laceration to buttocks Recorded as PROVOKED INCIDENT,N,11h00,Nurse shark
3437,19-Aug-1969,1969,Provoked,USA,"Marathon, Monroe County",Fishing,M,adult,Laceration to foot from dead shark PROVOKED INCIDENT,N,,"Lemon shark, 9' "
3439,09-Mar-1969,1969,Unprovoked,USA,"Makaha, O'ahu",Surfing,M,16,Leg & surfboard bitten,N,17h30,"White shark, identified by tooth fragments in surfboard"
3440,Reported 17-Feb-1969,1969,Provoked,AUSTRALIA,Taroona,Fishing,M,49,Lacerations to hand from hooked shark PROVOKED INCIDENT,N,Daytime,7-gill shark
3442,27-Jan-1969,1969,Unprovoked,AUSTRALIA,Beecroft Head,Freediving,M,21,Abrasions and lacerations to lower right leg,N,07h30,
3446,26-Dec-1968,1968,Provoked,AUSTRALIA,"Marineland Aquarium, Manley, Sydney",Feeding mullet to sharks,M,27,Laceration to finger by a captive shark PROVOKED INCIDENT,N,Morning,"Grey nurse shark, 10' "
3447,25-Dec-1968,1968,Unprovoked,NEW ZEALAND,"St. Clair Beach, Dunedin",Surfing,M,17,"Hit in face by shark, arm abraded, surfboard bitten",N,17h45,White shark
3449,02-Dec-1968,1968,Unprovoked,SOUTH AFRICA,"Bluff, Durban",Spearfishing,M,28,"No injury, left elbow & torso bumped by sharks",N,,"2 scalloped hammerhead sharks, 1.5 m & 1.8 m [5' & 6']"
3451,06-Nov-1968,1968,Boat,SOUTH AFRICA,Ramsgate,Fishing,M,22,"Shark leapt into boat, landed on Hlope's back, then bit his left forearm",N,,"90-kg ""blackfin"" shark"
3458,15-Sep-1968,1968,Unprovoked,NEW ZEALAND,Otago Harbor,Spearfishing,M,24,"FATAL, left leg bitten, femoral artery severed  ",Y,10h15,"White shark, 4.3 m [14'], (tooth fragment recovered)"
3459,24-Aug-1968,1968,Unprovoked,USA,Half mile north of Juno Beach Pier,Playing with a frisbee in the shallows,,9 & 12,"Shark bumped Colleen, the nudged Scott, then bit Frisbee & swam away with it",N,16h00,a small hammerhead shark
3460,21-Aug-1968,1968,Unprovoked,USA,Okaloosa County,Standing,M,15,Leg & arm bitten,N,17h00,
3463,08-Aug-1968,1968,Unprovoked,COLUMBIA,"Makuaka Caño, Taganga",Dynamite fishing,M,18,Lacerations to head,N,10h30,2 m shark
3464,27-Jul-1968,1968,Unprovoked,USA,"Bodega Rock, Sonoma County",Free diving,M,25,Major injury to torso,N,11h00,"White shark, 4 m [13'] "
3465,23-Jul-1968,1968,Unprovoked,USA,Florida Keys,Wading,M,33,Abrasions on lower leg,N,13h30,
3466,16-Jul-1968,1968,Unprovoked,USA,"Stono Inlet, near Charleston, Charleston County",Spearfishing using Scuba,M,33,Swimfin & knee bitten,N,Afternoon,4m [13'] shark
3469,25-Jun-1968,1968,Unprovoked,BAHAMAS,Spanish Wells ,Spearfishing,M,17,"Bumped shoulder, bit head",N,,1.5 m to 2 m [5' to 6.75'] Caribbean reef shark 
3470,09-Jun-1968,1968,Unprovoked,USA,"Mullet Key, Pinellas County",Clamming,M,17,Lacerations to lower right leg & andkle,N,09h30,
3474,29-Apr-1968,1968,Invalid,USA,"Fort Lauderdale, Broward County",Wading,M,63,Foot severely injured,,14h00,Shark involvement not confirmed
3475,20-Apr-1968,1968,Unprovoked,USA,"Palm Beach Shores, Riviera Beach, Singer Island, Palm Beach County",,M,10,"Buttock, both legs & arm bitten",N,12h30,2.7 m [9'] silky shark
3476,15-Apr-1968,1968,Unprovoked,AUSTRALIA,South Coast,"Diving. Shark swallowed his hand, so he threw his other around the shark and went shark-back riding for 30 yards until the shark opened its jaws",M,21,Hand lacerated,N,,"Bronze whaler shark, 1.8 m [6'] "
3478,07-Apr-1968,1968,Provoked,AUSTRALIA,Stockton Bight,,M,47,Foot lacerated Recorded as PROVOKED INCIDENT,N,Early morning,"""Blue whaler"" (Galeolamna)"
3479,25-Mar-1968,1968,Unprovoked,SOUTH AFRICA,Richards Bay,Wading & pushing dinghy toward  the shallows,M,35,Left thigh lacerated,N,Afternoon,1.5 m to 1.8m [5' to 6'] shark
3480,10-Mar-1968,1968,Unprovoked,USA,"Jensen Beach, Martin County",Surfing,M,20,Foot lacerated,N,Afternoon,
3481,Mar-1968,1968,Invalid,USA,Florida Keys,Treading water,M,28,No injury,,Night,Invalid
3482,26-Feb-1968,1968,Unprovoked,USA,Palm Beach County,Surfing,M,17,Foot lacerated,N,13h30,
3483,20-Feb-1968,1968,Unprovoked,AUSTRALIA,Swan River,Swimming,F,14,Thigh lacerated,N,Late afternoon,
3485,04-Feb-1968,1968,Unprovoked,AUSTRALIA,Cape Jervis,Spearfishing,M,26,"No injury, speargun bitten",N,18h30,"Bronze whaler shark, 3 m [10'] "
3492,30-Dec-1967,1967,Unprovoked,SOUTH AFRICA,Mossel Bay,Surfing,M,22,Right ankle & foot bitten,N,14h00,1.5 m to 1.8 m [5' to 6'] shark
3495,17-Dec-1967,1967,Unprovoked,AUSTRALIA,"Cheviot Beach, Portsea, Port Phillip Bay",Swimming,M,59,"FATAL, presumed taken by a shark, body not recovered",Y,A.M.,
3497,30-Nov-1967,1967,Provoked,AUSTRALIA,Wollongong,Freediving,M,15,Recorded as PROVOKED INCIDENT,N,,Grey nurse shark
3503,17-Oct-1967,1967,Unprovoked,USA,"McArthur Beach, Singer Island, Palm Beach Shores",Standing on sandbar,M,19,Left foot bitten,N,16h30,small blacktip shark
3510,01-Sep-1967,1967,Unprovoked,PAPUA NEW GUINEA,"Lamassa Island, 16 miles from Lambon Island",Spearfishing,M,23,FATAL,Y,,3.7 m [12'] shark
3511,27-Aug-1967,1967,Provoked,USA,Ventura,Pulling shark from the water,M,24,Nipped on shoulder by captive shark PROVOKED INCIDENT,N,14h30,5' blue shark
3514,19-Aug-1967,1967,Unprovoked,AUSTRALIA,Jurien Bay,"Spearfishing, dived to pick up a float line",M,23,"FATAL, ""bitten in two""",Y,11h00,White shark
3515,15-Aug-1967,1967,Unprovoked,BERMUDA,Hamilton,Floating,F,19,Right foot abraded & lacerated,N,16h00,
3517,10-Aug-1967,1967,Invalid,AUSTRALIA,Jervis Bay,Anti-sabotage night dive exercise alongside destroyer (Scuba diving),M,? & 19,"Disappeared, no trace of men or equipment, shark attack considered",,Night,Shark involvement prior to death was not confirmed
3518,07-Aug-1967,1967,Unprovoked,USA,Near Key West,Spearfishing,M,15,Shark grasped thigh,N,14h30,"Nurse shark, 106 cm, 28-lb, male "
3519,Aug-1967,1967,Unprovoked,BAHAMAS,Andros Island,Photographing sharks underwater using Scuba,M,41,"No injury, shark struck camera",N,Early afternoon,1.5 m to 1.8 m [5' to 6'] sandbar shark
3520,Aug-1967,1967,Unprovoked,SENEGAL,Hann,Beach seine netting,M,,Ankle bitten,N,04h00,1.8 m shark
3521,29-Jul-1967,1967,Unprovoked,USA,Florida Keys,Snorkeling,M,20,Foot lacerated,N,Afternoon,
3522,05-Jul-1967,1967,Unprovoked,TURKEY,Kucukada Island,Spearfishing,M,36,FATAL,Y,13h40,
3524,13-Jun-1967,1967,Provoked,USA,"Key West, Monroe County",Spearfishing,M,26,"After shark was speared & hit on head, it bit the divers foot  PROVOKED INCIDENT",N,17h30,"Nurse shark, 1 m "
3526,13 or 30-May-1967,1967,Provoked,AUSTRALIA,Outer Harbor,,M,30,Thigh abraded & lacerated Recorded as PROVOKED INCIDENT,N,Morning,Bronze whaler shark
3527,09-May-1967,1967,Provoked,AUSTRALIA,Aquarium,Feeding a shark,M,22,Recorded as PROVOKED INCIDENT,N,Afternoon,Grey nurse shark
3529,20-Mar-1967,1967,Provoked,NEW ZEALAND,Leigh,Freediving,M,21,Abrasions to lower leg Recorded as PROVOKED INCIDENT,N,Afternoon,
3530,19-Mar-1967,1967,Unprovoked,SOUTH AFRICA,Paradise Reef,Spearfishing,M,32,"Punctures in right buttock & thigh, abrasion on right forearm",N,06h50,"White shark, 3 m [10'] "
3531,12-Mar-1967,1967,Provoked,AUSTRALIA,Geelong,Spearfishing,M,36,Speared shark lacerated his arm PROVOKED INCIDENT,N,15h00,Grey nurse shark
3533,09-Mar-1967,1967,Unprovoked,NEW ZEALAND,St. Kilda Beach,Lifesaving drill,M,21,"FATAL, seen taken by a shark ",Y,19h45,Thought to involve a white shark
3539,06-Jan-1967,1967,Provoked,AUSTRALIA,Goolwa,Splashing,M,15,Foot bitten when he kicked shark PROVOKED INCIDENT,N,,"""sand shark"""
3540,31-Dec-1966,1966,Unprovoked,AUSTRALIA,"Piccaninny Point, 10 miles from Bicheno",Fishing,M,30,"6"" laceration to left forearm ",N,,2.1 m [7'] shark
3541,27-Dec-1966,1966,Provoked,AUSTRALIA,South West Rocks,Spearfishing,M,29,The shark bit the diver's leg after he shot it  PROVOKED INCIDENT,N,,"Grey nurse shark, 1.5 m [5'] "
3542,27-Dec-1966,1966,Unprovoked,AUSTRALIA,Trial Bay,Spearfishing,M,19,Right hand lacerated,N,,"Grey nurse shark, 1.5 m [5']"
3543,26-Dec-1966,1966,Unprovoked,SINGAPORE,Singapore,Wading,M,39,Thigh bitten,N,Afternoon,
3544,26-Dec-1966,1966,Unprovoked,AUSTRALIA,Coogee,Spearfishing,M,29,Right leg bitten,N,,1.8 m [6'] shark
3547,30-Oct-1966,1966,Unprovoked,PAPUA NEW GUINEA,"Lamassa Island, 16 miles from Lambom Island",Swimming,F,13,FATAL,Y,Morning,3.7 m [12'] shark
3548,19-Oct-1966,1966,Unprovoked,PAPUA NEW GUINEA,"Mission Beach, Lambon Island, near Duke of York Islands",Bathing,F,8,FATAL,Y,09h00,3.7 m [12'] shark
3549,27-Sep-1966,1966,Unprovoked,AUSTRALIA,"Broomfield Island, 11 miles from Heron Island on the Great Barrier Reef","Free diving, carrying speargun",M,32,Shoulder lacerated,N,16h45,"Bronze whaler shark, 2.1 m [7'], a tooth was embedded in the speargun "
3553,10-Sep-1966,1966,Unprovoked,AUSTRALIA,Roe Reef off Rottnest Island,Spearfishing,M,43,No injury,N,12h00,"Mako shark, 1.9 m [6.5'] "
3554,8-Sep-1966,1966,Provoked,USA,"Florida Keys, Monroe County",Hunting crayfish ,M,14,Abdomen abraded when he seized shark PROVOKED INCIDENT,N,,"Nurse shark, 2.5' "
3559,23-Aug-1966,1966,Unprovoked,NEW BRITAIN,"Butliwan Village, 15 miles north of Rabaul",Swimming,F,13,FATAL,Y,Midday,A pack of 6 sharks
3560,23-Aug-1966,1966,Unprovoked,NEW BRITAIN,"Butliwan Village, 15 miles north of Rabaul",Diving into water,F,9,FATAL,Y,Midday,A pack of 6 sharks
3561,16-Aug-1966,1966,Unprovoked,CROATIA,Bakar,Swimming,M,33,FATAL,Y,,White shark
3562,14-Aug-1966,1966,Unprovoked,TAIWAN,Ye Leow,Lobster diving using Scuba,M,,"No injury, but shark struck his calf",N,17h30,1.5 m to 2.1 m  [5' to 7'] shark
3563,13-Aug-1966,1966,Unprovoked,ITALY,"Pulsano, near Taranto",Attacked shark with fists,M,21,Arm lacerated,N,,"""small shark"""
3564,Mid Aug-1966,1966,Invalid,USA,Fenwick Island,Spearfishing on Scuba,M,26,"No attack, no injury, shark took speared fish & approached diver closely ",,17h00,Invalid
3565,Aug-1966,1966,Unprovoked,USA,"Municipal Bathing area, Riviera Beach, Palm Beach County",Wading,M,8,"No injury, mother lifted him from the water",N,15h00,Spinner or blacktip sharks
3566,31-Jul-1966,1966,Unprovoked,USA,"South Jetty, Galveston",Diving for sand dollars,M,16,Dorsum of right foot grazed,N,,Lemon shark or sandtiger shark
3567,19-Jul-1966,1966,Provoked,USA,"Folly Beach, Charleston County",Killing a shark,M,34,"Arm bitten, PROVOKED INCIDENT",N,18h40,4' shark
3568,17-Jul-1966,1966,Unprovoked,USA,"Point Comfort, Calhoun County",Fishing,M,14,Lacerations to right foot,N,15h00,
3571,03-Jul-1966,1966,Invalid,USA,"Key Biscayne, Miami, Dade County",Free diving,M,46,No injury. A 1.1 m [3.5'] blacktip shark shark made a threat display & bit gig,,07h00,Invalid
3573,22-Jun-1966,1966,Provoked,USA,"Reeds Bay, Brigantine, Atlantic County",Clamming,M,15,3 lacerations on  right leg by speared fish PROVOKED INCIDENT,N,16h00,"Local authorities speculated that the water was too cold for sharks, but a 2.1 m [7'], 200-lb pregnant sandbar shark was caught next day"
3574,11-Jun-1966,1966,Provoked,USA,"Ft. Lauderdale, Broward County",Fishing,M,18,Hand & forearm bitten by hooked shark PROVOKED INCIDENT,N,09h00,1.2 m [4'] hammerhead shark
3575,04-Jun-1966,1966,Unprovoked,USA,Bolivar Peninsula,Swimming,M,18,Punctures on  thigh & buttock,N,17h00,a small shark
3577,20-May-1966,1966,Sea Disaster,AUSTRALIA,Jervis Bay,Sinking of the dredge World Atlas,M,40,FATAL,Y,Night,
3578,20-May-1966,1966,Unprovoked,AUSTRALIA, Bellingen,Fishing,M,,Foot bitten,N,01h00,1.8 m [6'] shark
3579,20-May-1966,1966,Sea Disaster,AUSTRALIA,7 miles offshore on east coast of Australia,Shipwreck,M,38,"FATAL, other human remains bitten by sharks, 13 people missing",Y,Dark,Believed white shark and other smaller species of sharks involved.
3580,16-May-1966,1966,Invalid,USA,"Fernandina Beach, Nassau County",Spearfishing / Scuba diving,M,24,"White shark, 3.7 m [12']  made threat display. No injury, no attack",,14h00,Invalid
3586,27-Feb-1966,1966,Unprovoked,AUSTRALIA,Coledale Beach,Treading water,M,13,"Left leg & lower right leg bitten, taken ashore with shark still grasping his leg",N,14h00,"White shark, 2.5 m [8.25'], an immature female, previously injured"
3587,29-Jan-1966,1966,Provoked,SOUTH AFRICA,Strandfontein Beach,Helping men land a shark,M,33,Left leg lacerated by hooked shark  PROVOKED INCIDENT,N,Afternoon,Copper shark
3589,22-Jan-1966,1966,Unprovoked,USA,"Pebble Beach, Cypress Point, Monterey County",Free diving / spearfishing (resting on the surface),M,29,"Hand, arm & thigh bitten",N,10h00 / 11h00,"White shark, 3 m [10'] "
3590,15-Jan-1966,1966,Unprovoked,AUSTRALIA,Bellambi,Spearfishing,M,30,Buttocks bitten,N,,"Wobbegong shark, 5' "
3592,11-Jan-1966,1966,Unprovoked,SOUTH AFRICA,Riet River,Standing,M,16,Right calf lacerated,N,09h00,1.5 m to 1.8 m [5' to 6'] Zambesi shark
3593,10-Jan-1966,1966,Unprovoked,AUSTRALIA,Woodman Point,Jumped into the water,M,43,"Lower leg nipped, arm bruised when he landed in boat",N,,76 cm [2.5'] carpet shark
3594,09-Jan-1966,1966,Unprovoked,SOUTH AFRICA,Umkomaas,Body surfing,M,15,Lower legs bitten,N,14h00,"1.8 m to 2 m [6' to 6'9""] shark"
3595,08-Jan-1966,1966,Unprovoked,NEW ZEALAND,"Oakura Beach, Taranaki",Body surfing ,F,15,"FATAL, left leg bitten thigh to calf  ",Y,15h30,
3596,05-Jan-1966,1966,Unprovoked,USA,"Hollywood, Broward County",Swimming,M,35,Thigh gashed,N,16h00,Hammerhead shark
3597,Summer of 1996,1966,Invalid,USA,"Huntington Beach, Orange County",Walking,F,15,Minor lacerations & abrasions to lower leg. ,,"""After lunch""",Shark involvement not confirmed
3598,28-Dec-1965,1965,Unprovoked,AUSTRALIA,"Bathurst Reef, Rottnest Island","Spearfishing, but standing in knee-deep water",M,40,Thigh & swim fin bitten,N,,1.8 m [6'] carpet shark
3601,21-Nov-1965,1965,Provoked,AUSTRALIA,Near Brisbane,Fishing from 34' boat when pulled overboard by hooked shark,M,43,FATAL PROVOKED INCIDENT,Y,,4.6 m [15'] shark
3602,21-Nov-1965,1965,Unprovoked,PACIFIC OCEAN ,Japanese fishing boat Taihei Maru No.10,"Hauling dead shark aboard, when another shark leapt out of the water & bit him",M,44,"Left forearm bitten, surgically amputated",N,23h30,
3604,03-Nov-1965,1965,Unprovoked,AUSTRALIA,Oak Beach,Surfing,M,24,Puncture wounds to right thigh,N,16h30,"Grey nurse shark, 2.4 m [8'] "
3606,16-Oct-1965,1965,Unprovoked,BAHAMAS,Nassau,Sunbathing on beach when he saw child being attacked by the shark,M,32,Right arm & right leg bitten,N,,"1.8 m [6'], 180-lb shark"
3608,10-Oct-1965,1965,Unprovoked,NEW BRITAIN,"Outside the reef off Moputu Village, near Talasea","Spearfishing, shot a turtle",M,15,FATAL,Y,,2 sharks involved
3611,12-Sep-1965,1965,Provoked,PAPUA NEW GUINEA,Moem Village near Wewak,Fishing (rod & line),M,,Leg & hand bitten by shark that had been speared by another fisherman PROVOKED INCIDENT,N,14h00,0.9 m [3'] shark
3612,08-Sep-1965,1965,Unprovoked,MEXICO,Playa Villa del Mar,,M,23,Leg & arm bitten,N,18h00,300-kg [662-lb] shark
3614,26-Aug-1965,1965,Unprovoked,USA,"Steel Pier, Atlantic City, Atlantic County",Swimming,M,15,Right thigh lacerated,N,17h30,
3616,26-Jul-1965,1965,Unprovoked,MEXICO,Mocambo,Bathing,M,25,"FATAL, both legs severed ",Y,17h00,
3620,09-Jun-1965,1965,Unprovoked,MEXICO,Mocambo,Swimming,M,38,"Right forearm severed, right leg bitten and surgically amputated",N,14h00,
3628,29-Apr-1965,1965,Unprovoked,USA,"Hobe Sound, Martin County",,M,49,"Thighs abraded, puncture wounds in dorsal surface of left hand",N,15h00,Bull shark
3629,25-Apr-1965,1965,Invalid,USA,"Pacifica, San Mateo County",Surfing,M,19,Drowned & his body was not recovered. Sharks seen in area later that day but no shark involvement in surfer's death,,16h00,Invalid
3630,10-Apr-1965,1965,Unprovoked,USA,American Shoals off Key West,Spearfishing,M,28,Left hand severely lacerated,N,11h00,"White shark, 10' to 12' "
3631,04-Apr-1965,1965,Unprovoked,PALAU,Koror,Walking on reef,M,8,Right leg bitten,N,15h30,"Tiger shark, tooth fragment recovered"
3632,04-Apr-1965,1965,Unprovoked,USA,"Juno Beach, Palm Beach County",Paddling on surfboard,M,17,Left hand punctured & lacerated,N,07h15,Blacktip or spinner shark
3634,14-Mar-1965,1965,Unprovoked,USA,"Pompano Beach, Palm Beach County",Free diving,M,16,Survived,N,13h30,Mako shark
3635,14-Feb-1965,1965,Unprovoked,SOUTH AFRICA,Amatikulu,Treading water,M,25,"Abdomen, buttock, thigh, arm & hand bitten",N,15h00 or 15h45,"1.8 m [6'], 136-kg [300-lb] shark "
3636,04-Feb-1965,1965,Unprovoked,USA,"Granite Pier, Rockport",Scuba diving,M,18,Punctures on left thigh,N,14h30,1.2 m [4'] shark
3638,23-Jan-1965,1965,Unprovoked,SOUTH AFRICA,"Country Club Beach, Durban",Paddling rescue ski,M,22,"No injury, ski bitten",N,13h00,"White shark, 3.7 m [12'] "
3639,16-Jan-1965,1965,Unprovoked,SOUTH AFRICA,"Country Club Beach, Durban",Body surfing,M,20,Right thigh punctured,N,16h40,
3641,09-Jan-1965,1965,Unprovoked,NEW GUINEA,Off Gaire Village,Free diving,M,30,FATAL,Y,,4.9 m [16'] whaler
3646,May-Jun-1965,1965,Unprovoked,EGYPT,South of Hurghada,"Spearfishing, but standing in the water",M,25 to 35,Ankle and thigh bitten; shark made three strikes,N,,"1.5 m to 2.1 m [5' to 7'] shark, possibly a mako shark"
3649,25-Dec-1964,1964,Unprovoked,SOUTH AFRICA,Port Alfred,Swimming,M,19,"Hand, ankle & calf lacerated",N,17h00,Raggedtooth shark 
3652,09-Dec-1964,1964,Unprovoked,PAPUA NEW GUINEA,"Off Sing Village, Buka Island","Canoe swamped, swimming back to canoe",M,28,Survived,N,Late afternoon,2.1 m [7'] shark
3654,29-Nov-1964,1964,Unprovoked,AUSTRALIA,Lady Julia Percy Island,Free diving with seals,M,25,Left leg severed,N,14h30,"White shark, 2.4 m [8'] "
3655,18-Nov-1964,1964,Unprovoked,AUSTRALIA,"Fingal Beach, near Tweed Heads",Swimming out to rescue swimmers in difficulty,M,29,FATAL,Y,13h30,
3656,13-Nov-1964,1964,Provoked,AUSTRALIA,"North Solitary Island, 8 miles from Wolli","Filming underwater, carrying powerhead",M,25,"Shark made threat display, then diver hit it with powerhead PROVOKED INCIDENT",N,,"White shark, 2.7 m [9'1""], 750-lb "
3660,04-Oct-1964,1964,Unprovoked,AUSTRALIA,"Avalon Beach, near Mandurah, 50 miles south of Perth","Surfing, but swimming to his board",M,19,Abrasions & 11 teethmarks on right lower leg,N,09h30,"Grey nurse shark, 1.8 m [6']"
3662,20-Sep-1964,1964,Unprovoked,TAIWAN,"Tamsui Beach, Taipai",Swimming,M,32,FATAL,Y,14h00,
3663,07-Sep-1964,1964,Unprovoked,TAIWAN,Tamsui Beach,Swimming,M,20,Right thigh &  elbow bitten,N,13h30,1.8 m [6'] shark
3664,26-Aug-1964,1964,Unprovoked,USA,"Hollywood Beach, Broward County",Swimming,M,14,Bruised & abraded ankle,N,14h30,
3665,23-Aug-1964,1964,Unprovoked,MEXICO,Acapulco,Floating on his back in an inner tube,M,19,Right thigh bitten,N,14h00,1.8 to 2.4 m [6' to 8'] shark
3666,22-Aug-1964,1964,Invalid,USA,5 miles south of Palm Beach,Spearfishing / free diving,M,18,3 m to 3.7 m [10' to 12']  great hammerhead shark shark only made a threat display. No injury,,11h30,Invalid
3667,21-Aug-1964,1964,Unprovoked,USA,"Panama City, Bay County",Swimming,M,,"No injury,  bumped repeatedly",N,11h30,3' shark
3668,08-Aug-1964,1964,Unprovoked,USA,"2 miles off Jupiter, Palm Beach County",Spearfishing using scuba,M,28,"No injury, shark hit scuba tank",N,12h00,Hammerhead shark
3670,Aug-1964,1964,Unprovoked,PANAMA,Off Achutuppu Island near Ailigandi,Free diving / Spearfishingat edge of reef,M,21,Foot lacerated,N,,Less than 1.2 m [4']
3672,16-Jul-1964,1964,Unprovoked,SOUTH AFRICA,Island Rock,Searching for remains of  Dr. Marais,M,30,"No injury, shark charged & impaled itself on spear",N,,Zambesi shark
3679,28-Jun-1964,1964,Invalid,USA,Long Island,Attempting to swim across the Atlantic Ocean,F,29,"Disappeared, probable drowning but sharks in area led to speculation that she was taken by a shark",,Night,Shark involvement prior to death was not confirmed
3683,02-Jun-1964,1964,Invalid,SOUTH AFRICA,Port Edward,Swimming,M,40,"Skeletonized, except for head & feet. Possibly a drowning / scavenging",,>17h00,Shark involvement prior to death was not confirmed
3685,08-May-1964,1964,Unprovoked,FIJI,Naviti,Spearfishing,M,35,"FATAL, buttocks, lower abdomen & genitalia removed  ",Y,11h30,Tiger shark
3686,May 1964,1964,Unprovoked,PANAMA,"Achutupu, a small island ner Ailigandi",Skin diving,M,13,"FATAL, torso / abdomen severely bitten  ",Y,,1.8 m [6'] shark
3688,28-Mar-1964,1964,Unprovoked,AUSTRALIA,Surfers Paradise Beach near Victor Harbour,Surfing,M,19,Left thigh lacerated,N,,1.8 m [6'] shark
3689,28-Mar-1964,1964,Sea Disaster,PAPUA NEW GUINEA,30 miles from Port Moresby,"Canoe capsized with 10 occupants, 8 survived,  Hamilton swam off to seek help",M,32,Presumed FATAL,Y,Midnight,
3690,05-Mar-1964,1964,Unprovoked,USA,"Fort Lauderdale, Broward County",Skin diving ,M,38,"Minor injury, abdomen abraded when he collided with the shark",N,16h00,1.7 m [5.5'] shark
3694,14-Feb-1964,1964,Unprovoked,FIJI,"Nailou Village, Tunuloa Natewa Bay",Spearfishing,M,17,"FATAL, thigh and abdomen bitten ",Y,10h30,
3696,10-Feb-1964,1964,Unprovoked,NEW ZEALAND,"West of Pukerua Bay, Wellington",Spearfishing,M,26,"No injury to diver, shark bit speargun",N,18h30,"White shark, 3 m [10'] "
3697,08-Feb-1954,1964,Unprovoked,SOUTH AFRICA,Muizenberg,Body boarding,M,25,Right ankle lacerated,N,08h45,"White shark, 1.5 m [5'] k"
3699,05-Feb-1964,1964,Unprovoked,NEW ZEALAND,"St. Clair Beach, Dunedin",Swimming,M,19,"FATAL, both legs bitten & right leg severed at knee ",Y,06h45,"White shark, 3 m to 3.7 m [10' to 12'] "
3700,02-Feb-1964,1964,Invalid,AUSTRALIA,Brisbane,Swimming,M,23,Body not recovered  / May have drowned prior to shark involvement,,09h30,Shark involvement prior to death was not confirmed
3702,Feb-1964,1964,Unprovoked,USA,Palm Beach County,Floating,M,12,No injury,N,,Hammerhead shark
3705,23-Jan-1964,1964,Unprovoked,SOUTH AFRICA,Nahoon,Body surfing,M,39,Heel & ankle bitten,N,16h00,
3706,22-Jan-1964,1964,Unprovoked,SOUTH AFRICA,Nahoon,Standing,M,17,Heel bitten,N,11h00,
3709,11-Jan-1964,1964,Unprovoked,USA,Southeast Farallon Island,Spearfishing / Scuba diving (at surface),M,21,Leg & thigh bitten,N,12h00,White shark (tooth fragment recovered)
3711,04-Jan-1964,1964,Unprovoked,FIJI,Tuvuca Isalnd,Swimming,F,20,Deep lacerations to her right thigh,N,15h00,
3713,01-Jan-1964,1964,Unprovoked,SOUTH AFRICA,Mossel Bay,Diving for sinkers,M,,Lacerations and puncture wounds in right arm ,N,19h00 / 20h00,2.1 m to 2.4 m  [7' to 8'] shark
3715,29-Dec-1963,1963,Unprovoked,SOUTH AFRICA,"Catfish Rock, between Salt Rock & Shakas Rock",Standing,F,20,"Right hand & foot severed, thigh & buttock lacerated",N,14h00,"Zambesi shark, 1.8 m [6'] "
3716,26-Dec-1963,1963,Unprovoked,SOUTH AFRICA,Umhlanga Rocks,Swimming ,M,24,"Lower leg bitten & foot severed, leg surgically amputated below knee",N,15h00,1.8 m [6']  shark
3717,26-Dec-1963,1963,Unprovoked,AUSTRALIA,"Figtree Ledge, Hervey Bay",Sitting on gunwale of boat,M,,"No injury, shark's tail struck his armpit",N,Dawn,"4.3 m [14'], 1000-lb shark"
3718,25-Dec-1963,1963,Unprovoked,SOUTH AFRICA,Gonubie River Mouth,Swimming,M,18,"FATAL, shoulders, arms, abdomen & foot bitten  ",Y,15h45,
3720,22-Dec-1963,1963,Provoked,SOUTH AFRICA,"Next to West Street groyne, Durban",Helping friend land hooked shark,M,13,Foot lacerated  PROVOKED INCIDENT,N,18h30,"Dusky shark, 1 m "
3722,20-Dec-1963,1963,Unprovoked,SOUTH AFRICA,Hartenbos,Spearfishing,M,,Foot lacerated,N,12h00,"White shark, 1.7 m [5.5']"
3723,20-Dec-1963,1963,Unprovoked,SOUTH AFRICA,Umvoti,Splashing in surf,M,15,"FATAL, arm severed, leg bitten",Y,12h40,300- to 400-lb Zambesi shark
3724,08-Dec-1963,1963,Unprovoked,AUSTRALIA,55 miles south of Adelaide,Spearfishing,M,23,Torso & hand lacerated,N,12h45,White shark
3725,04-Dec-1963,1963,Unprovoked,NEW BRITAIN,Pomio,Spearfishing,M,22,"FATAL, leg severely bitten",Y,,Tiger shark
3726,30-Nov-1963 ,1963,Unprovoked,NEW ZEALAND,"Charteris Bay, Lyttleton Harbour",Treading water while alongside capsized yacht,M,20,Hand & lower leg severely injured,N,13h00,Possibly a broadnose 7-gill shark
3727,30-Nov-1963,1963,Provoked,PAPUA NEW GUINEA,"Kukipi, 150 miles west of Port Moresby in the Lakekamu River area",Fishing / standing in waist deep water,F,18,Left arm lacerated  PROVOKED INCIDENT,N,14h00,Tiger shark
3728,28-Nov-1963,1963,Unprovoked,FIJI,"Dravuwalu, Totoya Island",Fishing,F,21,Elbow bitten,N,11h00,>1.2 m [4'] tiger shark
3729,25-Nov-1963,1963,Unprovoked,FIJI,Rewa River,Spearing fish,M,25,Ankle & foot bitten,N,14h00,
