,Date,Year,Type,Country,Location,Activity,Sex,Age,Injury,Fatal (Y/N),Time,Species
2130,18-Mar-1999,1999,Unprovoked,USA,"Olowalu side of Lahina, Maui ","Swimming, towing a kayak",F,29,"FATAL, arm bitten ",Y,20h30,
2131,14-Mar-1999,1999,Unprovoked,NEW CALEDONIA,Ouvea,Spearfishing,M,,Multiple injuries,N,Morning,200 to 300 kg shark
2134,05-Mar-1999,1999,Unprovoked,USA,"Quarter mile offshore in Kaanapali, West Maui",Swimming near pod of whales,F,29,Tissue removed knee to thigh,N,10h45,3.7 m to 4.6 m [12' to 15'] shark seen in the vicinity
2136,23-Feb-1999,1999,Unprovoked,AUSTRALIA,Scotts Head,Surfing,M,35,"Left hand & forearm bitten, board bitten",N,Evening,Bronze whaler or tiger shark
2137,03-Feb-1999,1999,Unprovoked,USA,"Hobe Sound, Martin County",Surfing,M,25,Left hand bitten,N,15h30,Spinner shark
2138,29-Jan-1999,1999,Unprovoked,MAURITIUS,Belle-Mare,Spearfishing,M,47,Legs & torso injured,N,,Bull shark
2143,1999,1999,Unprovoked,SOUTH AFRICA,"Hospital Rock, Dyers Island",Spearfishing,M,30,Heel lacerated,N,12h00,"White shark, 4.6 m [15'] "
2145,24-Dec-1998,1998,Provoked,USA,"Ormond Beach, Volusia County",Surfing,M,19,Left foot bitten after he accidentally stepped on the shark         PROVOKED INCIDENT ,N,08h30,
2146,22-Dec-1998,1998,Unprovoked,AUSTRALIA,Middleton Beach,Standing,F,21,2 puncture wounds in left leg,N,15h30,
2147,Reported 20-Dec-1998,1998,Unprovoked,SOUTH AFRICA,"King's Beach, Port Elizabeth",Surfing,M,18,Leg bitten,N,17h00,Possibly a white shark
2149,15-Dec-1998,1998,Unprovoked,AUSTRALIA,Middleton Beach,Surfing,F,21,Leg injured,N,Afternoon,
2150,21-Nov-1998,1998,Unprovoked,USA,"Ocean Beach, Jaycee Park, Vero Beach, Indian River County",Swimming,M,9,FATAL,Y,14h00,Tiger shark
2151,14-Nov-1998,1998,Unprovoked,USA,"New Smyrna Beach, Volusia County",Surfing,M,14,Right foot bitten,N,08h45,1.2 m [4'] shark
2152,11-Nov-1998,1998,Unprovoked,USA,"South Beach Park, Indian River County",Walking,M,13,Survived,N,17h00,"A ""small shark"""
2153,05-Nov-1998,1998,Unprovoked,USA,Winchester Bay,Surfing,M,32,No injury,N,,"White shark, 5 m  to 6 m [16.5' to 20'] "
2154,02-Nov-1998,1998,Provoked,JAPAN,460 miles off Iwakuni,Fishing for tuna,M,52,PROVOKED INCIDENT    Knee bitten by shark trapped in net,N,,6' shark
2155,02-Nov-1998,1998,Unprovoked,BRAZIL," Boa Viagem Beach, Recife",Surfing,M,22,"FATAL, left forearm severed  ",Y,Late afternoon,Though to involve a white shark
2156,24-Oct-1998,1998,Unprovoked,USA,"Jupiter Beach, Palm Beach County",Swimming,F,17,Minor lacerations on right ankle & foot,N,Afternoon,
2163,22-Sep-1998,1998,Unprovoked,USA,"New Smyrna Beach, Volusia County",Surfing,M,18,Left arm lacerated,N,15h35,
2165,14-Sep-1998,1998,Unprovoked,USA,"Stuart Beach, Martin County",Surfing,M,28,Right foot bitten,N,,1.8 m [6'] shark
2166,Sep-1998,1998,Provoked,SENEGAL,Yoff Island,Spearfishing,M,25,Bitten by harpooned shark PROVOKED INCIDENT,N,,1.5 m shark
2167,30-Aug-1998,1998,Unprovoked,USA,"Ponce Inlet, Volusia County",Surfing,M,26,Toes lacerated,N,20h15,3' to 4' shark
2169,26-Aug-1998,1998,Unprovoked,USA,"Stinson Beach, Marin County",Boogie boarding,M,16,"Thigh, buttocks & lower back lacerated",N,14h16,"White shark, 5 m to 6 m [16.5' to 20'] "
2171,15-Aug-1998,1998,Unprovoked,BAHAMAS,Ambergris Cay,Spearfishing,M,28,Calf bitten,N,16h30,"Caribbean reef shark, 1.2 m to 1.5 m [4' to 5'] "
2172,13-Aug-1998,1998,Unprovoked,USA,"Ponce Inlet, Volusia County",Body-boarding,M,11,Left calf injured,N,,4.5' to 5' shark
2174,01-Aug-1998,1998,Unprovoked,SOUTH AFRICA,"Buffalo Bay, near Knysna",Surfing (or body boarding),M,19,Legs bitten,N,,"White shark, 4 m [13'] "
2175,01-Aug-1998,1998,Unprovoked,SOUTH AFRICA,Pringle Bay,Spearfishing,M,24,Leg bitten,N,13h00,"White shark, 4.9 m [16']"
2177,25-Jul-1998,1998,Unprovoked,USA,"New Smyrna Beach, Volusia County",Surfing,M,13,Calf bitten,N,P.M.,
2178,06-Jul-1998,1998,Unprovoked,SOUTH AFRICA,Plettenberg Bay,Wading,M,47,Right leg bitten,N,,"Raggedtooth shark, 1.2 m [4'] "
2179,11-Jul-1998,1998,Unprovoked,SOUTH AFRICA,St. Francis Bay,Surfing,M,16,Knee bitten,N,Morning,5' to 6' shark
2180,06-Jul-1998,1998,Unprovoked,SOUTH AFRICA,Plettenberg Bay,Surfing,M,10,Right leg bitten,N,,"Raggedtooth shark, 1.2 m [4'] "
2181,28-Jun-1998,1998,Unprovoked,AUSTRALIA,South Neptune Island,Free diving for abalone,M,26,"FATAL, left thigh and lower leg severely injured  ",Y,14h00,Thought to involve a 5.5 m white shark named Kong
2182,22-Jun-1998,1998,Unprovoked,SOUTH AFRICA,"Gonubie, 13 km northeast of East London",Body Boarding,M,20,"FATAL, hands & calf bitten  ",Y,09h55,White shark
2183,08-Jun-1998,1998,Unprovoked,USA,"Daytona Beach, Volusia County",Surfing,M,18,"2-inch laceration on dorsum of foot, 1-inch laceration on sole.",N,18h00,
2186,29-May-1998,1998,Unprovoked,SOUTH AFRICA,Sardinia Bay near Port Elizabeth,Body boarding,M,15,Right shoulder & arm bitten,N,2 hours after Opperman,3 m to 4 m [10' to 13'] white shark
2187,29-May-1998,1998,Unprovoked,SOUTH AFRICA,Jeffreys Bay,Body boarding,M,16,Leg bitten,N,Early afternoon,Unidentified
2188,25-May-1998,1998,Unprovoked,USA,"New Smyrna Beach, Volusia County",Surfing,M,40,4 lacerations on the sole of his right foot,N,11h10,"Lemon shark, 1.5 m [5'], identified  by the surfer"
2189,16-May-1998,1998,Unprovoked,USA,"Pecks Lake, Martin County",Swimming,F,14,Ankle & foot bitten,N,14h30,"1.8 m [6'] shark, possibly a blacktip"
2190,16-May-1998,1998,Unprovoked,USA,"Walden Rocks, St. Lucie County",Swimming / surfing,M,24,Left arm & wrist lacerated,N,15h00,
2191,16-May-1998,1998,Unprovoked,SOUTH AFRICA,Keurbooms,Body boarding,M,22,"Lower legs bitten, foot severed",N,14h45,4 m [13'] white shark
2192,26-Apr-1998,1998,Unprovoked,MOZAMBIQUE,"Bilene Bay, 180 km north of Maputo",Towing rubber dinghy,F,35,"FATAL, torso & abdomen bitten, forearm severed ",Y,15h05,3 m [10'] shark
2193,21-Apr-1998,1998,Unprovoked,USA,Gleneden Beach,Surfing (lying prone on his board),M,50,Right thigh bitten,N,09h30 ,5 m [16.5'] white shark
2194,17-Apr-1998,1998,Provoked,USA,"Marathon, Monroe County",Scuba diving,M,16,"He grabbed shark's tail, shark bit his chest & held on.  PROVOKED INCIDENT",N,,"Nurse shark, 0.9 m [3'] "
2197,31-Mar-1998,1998,Unprovoked,USA,"Jensen Beach Park, Martin County",Swimming,M,40,Heel lacerated,N,15h30,
2198,15-Mar-1998,1998,Unprovoked,SOUTH AFRICA,Saldanha Bay,Snorkeling  hunting crayfish and abalone,M,33,Lower leg lacerated,N,17h30,3 m [10'] white shark
2199,08-Mar-1998,1998,Unprovoked,USA,"Loggerhead Park, Juno Beach, Palm Beach County",Swimming or paddle boarding,M,32,6 puncture wounds to right calf,N,Morning,5' spinner shark
2200,23-Feb-1998,1998,Unprovoked,USA,"Jensen Beach, Martin County",Swimming,M,,Hands bitten,N,09h35,Spinner shark
2201,Reported 28-Jan-1998,1998,Invalid,AUSTRALIA,Whale Beach,Spearfishing,M,31,"Missing, thought to have been taken by a shark",,20h00,Shark involvement not confirmed
2206,14-Jan-1998,1998,Unprovoked,MOZAMBIQUE,Ponta do Ouro,Surfing,M,23,Leg bitten,N,13h15,Small dusky shark or blackfin shark
2210,28-Dec-1997,1997,Unprovoked,SOUTH AFRICA,"Pringle Bay, 44 miles southeast of Cape Town",Spearfishing,M,39,FATAL,Y,14h00,White shark
2214,09-Nov-1997,1997,Unprovoked,AUSTRALIA,Albany,Scuba diving (submerged riding a scooter),M,42,Left arm lacerated when shark grabbed scooter,N,Morning,White shark
2217,28-Oct-1997,1997,Unprovoked,AUSTRALIA,"Cottesloe Beach, Perth",Surf-skiing,M,51,"Sierakowski suffered a minor facial injury, ski bitten in half by shark",N,,5.5 m [18'] white shark
2218,28-Oct-1997,1997,Unprovoked,USA,"Waiokapua Bay/Majors Bay, Brennecke Beach, Poipu, Kaua'i Island",Body boarding or surfing,M,19,"Both legs bitten, right leg severed at mid-calf & defense wounds on right hand",N,07h20,"Tiger shark, 4 m to 4.3 m [13' to 14'] "
2219,24-Oct-1997,1997,Unprovoked,USA,"North Jetty, Fort Pierce Inlet State Park, St. Lucie County",Surfing,M,23,"5"" gash in foot",N,17h15,Possibly a blacktip shark
2220,21-Oct-1997,1997,Unprovoked,USA,"North Jetty, Fort Pierce Inlet State Park, St. Lucie County",Surfing,M,12,Left foot bitten,N,18h00,1.2 m to 1.5 m [4' to 5'] shark
2222,04-Oct-1997,1997,Unprovoked,USA,"Daytona Beach, Volusia County",Swimming,F,14,Laceration & 3 puncture wounds to anterior right thigh,N,08h30,
2224,09-Sep-1997,1997,Unprovoked,USA,Volusia County  ,Surfing,M,12,Laceration to right foot,N,17h15,
2225,08-Sep-1997,1997,Unprovoked,USA,"New Smyrna Beach, Volusia County",Surfing,,17,2 small lacerations to bottom of foot,N,Evening,small blacktip shark
2226,06-Sep-1997,1997,Unprovoked,USA,"New Smyrna Beach, Volusia County",Surfing,M,20,Lacerations to lower left leg,N,15h20,
2227,30-Aug-1997,1997,Unprovoked,USA,"New Smyrna Beach, Volusia County",Surfing,M,18,Lacerations on right ankle & heel,N,13h00,
2228,27-Aug-1997,1997,Unprovoked,USA,"New Smyrna Beach, Volusia County",Walking / surfing,M,22,"2"" laceration on left heel",N,11h20,
2229,24-Aug-1997,1997,Unprovoked,USA,"Clam Beach, near Eureka, Humboldt County",Surfing (sitting on his board),M,29,Leg & hand bitten,N,12h30,5 m [16.5'] white shark
2231,14-Aug-1997,1997,Unprovoked,MEXICO,"Santa Rosa, Cozumel",SCUBA diving,M,33,"FATAL, arm & leg severed ",Y,,"Tiger shark, 5.2 m [17']"
2232,11-Aug-1997,1997,Unprovoked,USA,"New Smyrna Beach, Volusia County",Floating on raft,F,12,Small lacerations on right lower leg,N,14h16,
2234,11-Aug-1997,1997,Unprovoked,EGYPT,Safaga,Fishing,M,16,FATAL,Y,,Thought to involve an oceanic whitetip shark or a white shark
2235,10-Aug-1997,1997,Unprovoked,USA,"New Smyrna Beach, Volusia County",Boogie boarding,M,17,Lacerations to foot,N,11h48,
2237,05-Aug-1997,1997,Unprovoked,USA,"East Beach, Galveston",Wading,F,10,Wrist & am bitten,N,,1 m shark
2239,02-Aug-1997,1997,Unprovoked,USA,"New Smyrna Beach, Volusia County",Body surfing,M,17,Top of left foot bitten,N,15h45,juvenile shark
2240,02-Aug-1997,1997,Unprovoked,USA,"New Smyrna Beach, Volusia County",Wading / Surfing,M,19,Top of left foot bitten,N,09h15,"""juvenile shark"""
2241,27-Jul-1997,1997,Unprovoked,AUSTRALIA,"Pincushion, north of Maroochydore Beach",Surfing,M,19,Leg lacerated,N,14h25,
2242,21-Jul-1997,1997,Unprovoked,SOUTH AFRICA,"Breezy Point, Ntlonyana",Surfing,M,25,FATAL,Y,12h45,4.5 m white shark
2244,14-Jul-1997,1997,Unprovoked,USA,"Myrtle Beach, Horry County",Standing,M,50,Left calf bitten,N,Night,Blacktip shark
2245,12-Jul-1997,1997,Unprovoked,OKINAWA,Hirara,Fishing for octopus,M,55,"FATAL, legs severed  ",Y,,White shark
2247,24-Jun-1997,1997,Unprovoked,USA,"Sunset Beach, Oahu",Spearfishing / night diving,M,,Leg bitten just above ankle,N,23h00,2.4 m [8'] shark
2248,15-Jun-1997,1997,Unprovoked,FIJI,Off a small island 5 km from Garden Island Resort,Snorkeling,F,47,"Bitten on inner thigh, leg surgically amputated",N,14h30,"Tiger shark, 2.7m  [9']"
2249,09-Jun-1997,1997,Unprovoked,USA, Palm Beach County,Surfing,M,18,Laceration to left upper arm,N,18h00,Possibly a spinner shark
2251,02-Jun-1997,1997,Unprovoked,USA,"Daytona Beach Shores,  Volusia County","Body surfing, stood up on sandbar",M,33,4 lacerations above left ankle,N,10h25,1.2 m [4'] shark (spinner shark?)
2252,31-May-1997,1997,Unprovoked,USA,In Gulf of Mexico 17 miles off Weeki Wachee ,Spearfishing,M,35,Right thigh punctured,N,Morning,4' shark
2253,31-May-1997,1997,Unprovoked,USA,"Flagler Beach, Flagler County",Surfing,M,34,Left elbow bitten,N,11h00,Possibly a sand shark
2254,31-May-1997,1997,Unprovoked,USA,"Flagler Beach, Flagler County",Surfing,M,12,Left ankle bitten,N,11h00,Possibly a sand shark
2255,26-May-1997,1997,Unprovoked,BAHAMAS,Powell Cay,Spearfishing,M,54,Right arm bitten,N,,Possibly a Caribbean reef shark
2257,20-Apr-1997,1997,Unprovoked,BRAZIL,"Manguinhos, Ilha Feia, Búzios",Windsurfing,M,22,Lower left leg & ankle bitten,N,,3.7m  to 4.2 m white shark
2258,28-Feb-1997,1997,Unprovoked,AUSTRALIA,"Carrara, Nerang River",Swimming,F,21,Left leg biten,N,,a small shark
2259,28-Feb-1997,1997,Unprovoked,AUSTRALIA,Whitsunday Passage,Scuba diving,M, 30,Left arm bitten,N,Midday,"Tiger shark, 2m to 3m "
2263,25-Jan-1997,1997,Unprovoked,AUSTRALIA,"Whitehaven Beach, Whitsundays Island",Snorkeling,M,27,"Left leg lacerated, punctures to right leg",N,11h00 / 11h30,1.8 m to 2.1 m [6' to 7'] shark
2264,20-Jan-1997,1997,Unprovoked,AUSTRALIA,Geraldton,Windsurfing,M,41,"Presumed fatal, no body recovered, shark mutilated wetsuit & harness recovered ",Y,18h00,"Tiger shark, 4.5 m [14'9""]"
2268,10-Dec-1996,1996,Unprovoked,SOUTH AFRICA,"Duck Pond, Sardina Bay near Port Elizabeth",Surfing,M,,Elbow bitten,N,16h15,White shark
2271,29-Nov-1996,1996,Unprovoked,USA,"Salmon Creek Beach, Sonoma County",Surfing,M,45,Single laceration on ankle & board bitten,N,08h30,3 m to 5 m [10' to 16.5'] white shark
2272,18-Nov-1996,1996,Unprovoked,USA,"Coral Cove Park, Palm Beach County",Surfing,M,26,Right foot bitten,N,17h00,
2276,05-Oct-1996,1996,Unprovoked,USA,"Dillon Beach, Marin County",Surfing,M,22,Lower leg bitten,N,13h00,5.5 m to 6 m [18' to 20'] white shark
2277,03-Oct-1996,1996,Unprovoked,USA,"Cocoa Beach, Brevard County",Surfing,M,21,"4"" laceration on left forearm",N,08h30,1.2 m [4'] shark
2278,03-Oct-1996,1996,Unprovoked,USA,"North Salmon Creek Beach, Sonoma County",Surfing,M,31,"No Injury, shark struck his board",N,07h19,5 m [16.5'] white shark
2280,18-Sep-1996,1996,Unprovoked,USA,"New Smyrna Beach, Volusia County",Swimming,M,14,4 or 5 lacerations on left ankle,N,13h37,
2281,06-Sep-1996,1996,Unprovoked,NEW ZEALAND,Waihere Bay,Diving for abalone,M,23,"Back, arms & wrist severely lacerated",N,10h00,White shark
2282,06-Sep-1996,1996,Unprovoked,USA,"New Smyrna Beach, Volusia County",Surfing / Swimming,M,19,Small puncture wounds and lacerations on right leg just below knee,N,12h15,"""a young shark"""
2283,02-Sep-1996,1996,Unprovoked,USA,"Behune Beach, Volusia County",Standing,M,5,Right foot bitten,N,18h05,
2284,02-Sep-1996,1996,Unprovoked,USA,"Bethune Beach, Volusia County",Sitting on surfboard,M,28,Small lacerations on left foot,N,13h25,
2285,01-Sep-1996,1996,Invalid,USA,"Garden City Beach, Horry County",Boogie boarding,F,28,Minor injuries to foot,,Afternoon,Shark involvement not confirmed
2286,01-Sep-1996,1996,Provoked,SOUTH AFRICA,Hibberdene,Spearfishing,M,29,No injury  PROVOKED INCIDENT,N,07h19,White shark
2287,29-Aug-1996,1996,Unprovoked,USA,"Paukukalo, Maui",Body Boarding,M,19,Right calf bitten,N,16h00,"Tiger shark, 2.4 m [8'] "
2288,13-Aug-1996,1996,Unprovoked,USA,"Bird Rock, Tomales Point",Free diving for abalone,M,36,"Left shoulder, forearm, hand & abdomen lacerated",N,11h15,6 m [20'] white shark
2289,11-Aug-1996,1996,Unprovoked,USA,"Bayshore Garden, Sarasota Bay, Sarasota County",Wade fishing,M,21,"No injury, towed by shark that grabbed stringer of fish tied to his waist",N,14h00,1.8 m to 2.1 m [6' to 7'] hammerhead shark
2290,26-Jul-1996,1996,Unprovoked,USA,"Wiggins Pass, Collier County",Standing,F,8,Survived,N,19h30,
2291,23-Jul-1996,1996,Unprovoked,OKINAWA,Hirara City,Swimming,M,52,"FATAL, torso & abdomen bitten,  forearm severedL",Y,,5 m [16.5'] white shark
2292,23-Jul-1996,1996,Unprovoked,EGYPT / ISRAEL,"1 km off the mouth of Marsa Bereika, north of Ras Mohammed",Free diving with a pod of dolphins,M,,"Bitten on back, shoulder & chest",N,18h00,said to involve an oceanic whitetip shark
2293,21-Jul-1996,1996,Unprovoked,USA,"Truro (Cape Cod), Barnstable County",Swimming,M,46,Lacerations to left leg & right foot ,N,,6' shark
2294,20-Jul-1996,1996,Unprovoked,USA,"New Smyrna Beach, Volusia County",Swimming,M,9,Laceration to right arm,N,13h30,
2297,04-Jul-1996,1996,Unprovoked,USA,"Public Beach, Siesta Key, Sarasota County",Standing,F,63,Laceration on left foot,N,14h00,5' to 6' shark
2299,25-Jun-1996,1996,Unprovoked,USA,"Fripp Island, Beaufort County",Body surfing,F,24,"Lacerations to left shin, heel & foot",N,Afternoon,
2300,06-Jun-1996,1996,Unprovoked,AUSTRALIA,"Suicide Point, Point Leo",Surfing,M,,"No injury, board bitten",N,17h30,4 m white shark
2302,28-May-1996,1996,Unprovoked,SOUTH AFRICA,"The Steps, Wilderness",Surfing,M,17,Leg bitten,N,14h45,2.5 m [8.25'] white shark 
2303,24-May-1996,1996,Invalid,AUSTRALIA,"Wreck of paddle steamer, Koputai, 6 km off Bondi Beach",Tech diving ,M,45,"FATAL, but shark involvement prior to death was not confirmed",Y,,Shark involvement prior to death suspected but not confirmed
2304,18-May-1996,1996,Unprovoked,USA,"South of Ponce Inlet, Volusia County",Surfing,M,22,Right foot & ankle bitten,N,13h40,1.2 m [4'] shark
2306,07-May-1996,1996,Unprovoked,USA,"Shark Shallows, Ponce Inlet, Volusia County",Surfing,M,27,Left foot & leg bitten,N,11h06,60 cm to 90 cm [2' to 3'] blacktip or spinner shark
2308,25-Apr-1996,1996,Unprovoked,AUSTRALIA,Mona Vale,Swimming,M,11,Puncture wounds on upper left thigh ,N,,Wobbegong shark
2309,25-Apr-1996,1996,Unprovoked,AUSTRALIA,Mona Vale,Swimming,F,16,Puncture wounds on leg ,N,,Wobbegong shark
2311,05-Mar-1996,1996,Unprovoked,AUSTRALIA,Heron Island,Swimming breast stoke,F,47,Left arm & leg lacerated,N,07h00,Tiger shark
2312,Mar-1996,1996,Unprovoked,AUSTRALIA,Lord Howe Island,Fishing in knee-deep water,M,7,Left calf bitten,N,,1.5 m [5'] shark
2313,26-Feb-1996,1996,Unprovoked,AUSTRALIA,"Charles Street Wharf, Parramatta River",Dived naked into the water on a bet,M,24,Left leg & right testicle bitten,N,Night,Bronze whaler shark
2314,Reported      19-Feb-1996,1996,Provoked,USA,St. Louis,Swimming in fish tank,F,32,5 punctures to hand from captive shark PROVOKED INCIDENT,N,,nurse shark
2319,04-Feb-1996,1996,Unprovoked,AUSTRALIA,"Ned's Beach, Lord Howe Island",Swimming,M,7,Ankles injured,N,Afternoon,"""reef shark"""
2320,23-Jan-1996,1996,Provoked,USA,"Florida Keys, Monroe County",Wading,M,33,Shark bit his leg after he grabbed its tail & wouldn't let go PROVOKED INCIDENT,N,,"Nurse shark, 0.9 m  [3'] "
2321,22-Jan-1996,1996,Unprovoked,AUSTRALIA,"Brown's Inlet, Broadwater",Swimming,F,13,Lacerations to left calf,N,,Bronze whaler shark
2322,16-Jan-1996,1996,Unprovoked,USA,"KaelekiI Point, Maui",Swimming with mask & snorkel,M,53,Lacerations to left foot & right shin,N,15h45,Possibly a tiger shark
2325,10-Jan-1996,1996,Unprovoked,REUNION,Embouchure de l'étang de Saint Paul,Surfing,M,25,FATAL,Y,16h00,"Tiger shark, 300-kg [662-lb] "
2335,11-Oct-1995,1995,Unprovoked,AUSTRALIA,"Pialba, Hervey Bay",Playing / standing,F,15,Laceration to thigh,N,14h30,4 m shark
2336,01-Oct-1995,1995,Unprovoked,USA,"Ormond Beach, Volusia County",Surfing,M,39,Right arm injured,N,11h30,1.2 m to 1.5 m [4' to 5']   shark
2337,30-Sep-1995,1995,Unprovoked,USA,"Crescent Beach, St. Augustine, St. Johns County",Surfing,M,14,4 punctures in left foot,N,Morning,1.5 to 1.8 m [5' to 6'] shark
2339,28-Sep-1995,1995,Unprovoked,USA,"Davenport Landing, Santa Cruz County",Windsurfing,M,25,"Right foot bruised, board bitten",N,17h30,4 m [13'] white shark
2340,19-Sep-1995,1995,Unprovoked,USA,"Matanzas Bay Inlet, St. Johns County",Surfing,M,19,Left arm & hand lacerated,N,,1.8 m [6'] shark
2341,17-Sep-1995,1995,Unprovoked,USA,"Daytona Beach, Volusia County",Swimming,F,19,Left elbow and bicep bitten,N,15h40,
2343,13-Sep-1995,1995,Unprovoked,USA,"Alligator Reef, off Islamorada, Monroe County",Scuba diving,M,25,"Presumed FATAL, body not recovered",Y,,3 m to 3.7 m [10' to 12'] bull shark
2344,11-Sep-1995,1995,Unprovoked,AUSTRALIA,"Honeymoon Island, near Hopetown",Abalone diving using Hookah (near calving whales),M,29,"FATAL, head, shoulder and arm severed, remains recovered at Munglinup Beach on 9/13/1995",Y,15h00,White shark
2345,03-Sep-1995,1995,Unprovoked,USA,"Shelter Cove, Humboldt County",Abalone diving using Hookah (resting on the surface),M,32,Lower leg bitten,N,16h00,3 m to 4 m [10' to 13'] white shark
2347,31-Aug-1995,1995,Unprovoked,USA,"North Beach Inlet, St. Lucie County",Surfing,M,19,Left hand & forearm bitten,N,,1.2 m to 1.5 m [4' to 5'] shark
2350,26-Aug-1995,1995,Unprovoked,USA,"Crescent Beach, St. Johns County",Surfing,M,16,Left elbow bitten,N,18h30,5' shark
2351,26-Aug-1995,1995,Unprovoked,USA,"Ponce de Leon Inlet, Volusia County",Surfing,M,18,4 puncture wounds on right pinky finger,N,14h10,"""a small shark"""
2352,25-Aug-1995,1995,Unprovoked,USA,"Off Masonboro Island, New Hanover County",Swimming,M,16,Left arm bitten,N,"""Night""",1.2 m to 1.5 m [4' to 5'] shark
2353,22-Aug-1995,1995,Unprovoked,USA,"Wrightsville Beach, New Hanover County",Swimming ,M,23,Right foot bitten,N,Afternoon,"""sand"" shark"
2354,22-Aug-1995,1995,Unprovoked,USA,"Ponce de Leon Inlet, Volusia County",Surfing,M,19,Bottom of left foot gashed,N,19h00,"""small shark"""
2356,19-Aug-1995,1995,Unprovoked,TONGA,Near Tapana Island,Fishing,M,18,Upper left thigh avulsed  ,N,15h00,"""small shark"""
2357,15-Aug-1995,1995,Unprovoked,USA,"Daytona Beach, Volusia County ",Wading,M,20,Thigh lacerated,N,08h30,1.8 m [6'] shark
2359,10-Aug-1995,1995,Unprovoked,USA,"Ponce Inlet, Volusia County",Surfing,M,20,Laceration to left heel,N,13h30,
2360,10-Aug-1995,1995,Unprovoked,USA,"Ocean Lakes Campground, south of Myrtle Beach, Horry County","""Riding waves on a board""",F,14,Left foot bitten,N,,Blacktip shark
2361,07-Aug-1995,1995,Unprovoked,USA,"Ponce de Leon Inlet, Volusia County ",Body boarding,M,12,Multiple bites on right leg and knee,N,14h10,1.2 m to 1.5 m [4' to 5'] shark
2366,28-Jul-1995,1995,Unprovoked,USA,"New Smyrna Beach, Volusia County",Surfing,M,18,Laceration to heel,N,14h10,
2367,28-Jul-1995,1995,Unprovoked,USA,"New Smyrna Beach, Volusia County",Standing,M,18,2-inch laceration to lower right leg ,N,13h40,
2372,08-Nov-1984,1984,Unprovoked,SOUTH AFRICA,Gonubie River Mouth,Surfing,M,14,Wetsuit lacerated,N,17h00,
2374,03-Jul-1995,1995,Provoked,USA,"Cat Island, Harrison County",Fishing,F,32,Minor laceration to leg from a hooked shark PROVOKED INCIDENT,N,,Blacktip shark
2376,30-Jun-1995,1995,Unprovoked,USA,"Bluefish Cove, Pt. Lobos State Park, Monterey County",Scuba diving (ascending using scooter),M,31,"Forearm, abdomen & upper leg lacerated",N,17h30,6 m [20'] white shark
2378,23-Jun-1995,1995,Unprovoked,USA,"Tybee Island, Chatham County",Playing / jumping,M,13,Ankle bitten,N,,"""sand"" shark"
2380,17-Jun-1995,1995,Unprovoked,USA,"Jensen Beach Park, Martin County",Swimming,M,45,Right leg bitten,N,18h30?,1.8 m [6'] shark
2381,16-Jun-1995,1995,Unprovoked,USA,"Tiger Shores Beach, Martin County",Swimming,F,10,Leg bitten,N,14h00,6' shark
2382,14-Jun-1995,1995,Unprovoked,USA,"Opposite Grand Wailea Resort, Wailea, Maui",Swimming,M,38,Puncture wounds & scratches to torso & left leg ,N,11h50,"Tiger shark, 3.7 m [12'] "
2383,13-Jun-1995,1995,Unprovoked,HONG KONG,First Beach,Swimming,F,45,"FATAL, left  leg & forearm severed",Y,,Though to involve a tiger shark
2384,02-Jun-1995,1995,Unprovoked,HONG KONG,Sheung Sze Wan Beach,Swimming,M,29,"FATAL, right thigh bitten, femur exposed  ",Y,14h30,1.8 m to 2.1 m [6' to 7'] shark
2386,26-May-1995,1995,Unprovoked,USA,"Vero Beach, Indian River County",Surfing,M,15,Left foot bitten,N,,Possibly a bull shark
2387,24-May-1995,1995,Unprovoked,FIJI,Waya Island,Sleeping in anchored boat,M,69,"FATAL, hand & leg severely injured by shark that leapt into boat  ",Y,,3.7 m [12'] shark
2389,12-May-1995,1995,Unprovoked,SOUTH KOREA,Jangkodo Island,Diving for abalone,F,44,Right leg severed FATAL,Y,,4 m shark
2393,09-Apr-1995,1995,Unprovoked,JAPAN,Atsumi Peninsula,Scuba diving for bivalves,M,47,FATAL,Y,10h15,6 m [20'] white shark
2395,11-Mar-1995,1995,Unprovoked,AUSTRALIA,Cactus Beach,Surfing,M,35,Left arm lacerated,N,07h30,"Bronze whaler shark, 2 m "
2397,19-Feb-1995,1995,Unprovoked,SOUTH AFRICA,Kidds Beach,Swimming,M,22,Lacerations to lower leg & foot,N,17h15,Raggedtooth shark
2399,24-Jan-1995,1995,Unprovoked,SOUTH AFRICA,Isipingo,Swimming,M,14,"FATAL, right thigh bitten & femur exposed, shallow lacerations on right calf & left thigh & fingers lacerated ",Y,18h00,"Tiger shark, 1.8 m [6'] "
2400,02-Jan-1995,1995,Unprovoked,BRAZIL,Piedade,Surfing,M,17,Foot bitten,N,, 
2405,30-Dec-1994,1994,Unprovoked,SOUTH AFRICA,Mossel Bay,Body boarding,M,26,"No injury, board bitten",N,16h00,5.5 m [18'] white shark
2411,09-Dec-1994,1994,Unprovoked,USA,"San Miguel Island, Santa Barbara County",Commercial diver (submerged or treading water),M,42,"FATAL, right leg nearly severed, puncture wounds to left leg ",Y,08h45,5 m to 5.5 m [16.5' to 18'] white shark
2414,13-Nov-1994,1994,Unprovoked,USA,"Off the Hanalei River, Kaua'i","Surfing, paddling seawards",F,34,Right thigh & board bitten,N,09h45,2.7 m [9'] shark
2418,09-Oct-1994,1994,Provoked,USA,"Bill Baggs Cape Florida State Recreation Area, Miami-Dade County",Wading,F,9,Ankle bitten when she accidently stepped on the shark  PROVOKED INCIDENT,N,13h00,Thought to involve a small sand shark
2419,05-Oct-1994,1994,Unprovoked,USA,"Indialantic, Brevard County",Surfing,M,16,Foot bitten,N,12h00,
2421,21-Sep-1994,1994,Unprovoked,USA,"Short Sand Beach, Oswald West State Park",Surfing,M,43,"No injury, surfboard bitten",N,16h30,5 m [16.5'] white shark
2423,05-Sep-1994,1994,Unprovoked,USA,Makaha Surf Beach,Jumped off rocks into white water,F,12,Left calf bitten,N,11h15,Small shark
2427,09-Jul-1994,1994,Unprovoked,REUNION,Barachois,Windsurfing,M,24,FATAL,Y,13h45,3 to 3.5 m [10' to 11.5'] bull shark
2428,09-Jul-1994,1994,Unprovoked,SOUTH AFRICA,"Nahoon Beach, East London",Surfing,M,22,"FATAL, leg severed ",Y,13h26,4 m [13'] white shark
2429,09-Jul-1994,1994,Unprovoked,SOUTH AFRICA,"Nahoon Beach, East London",Surfing,M,31,Buttock & leg bitten,N,13h25,4 m [13'] white shark
2431,08-Jul-1994,1994,Unprovoked,USA,"New Smyrna Beach, Volusia County",Surfing,M,15,Right calf lacerated,N,15h00,"""small shark"""
2432,24-Jun-1994,1994,Unprovoked,BAHAMAS,Freeport,Spearfishing,M,30,Forearm severely bitten,N,15h30,1.8 m [6'] shark
2433,31-May-1994,1994,Unprovoked,USA,"Ponce Inlet, Volusia County",Surfing,M,24,Foot lacerated,N,10h30,
2434,31-May-1994,1994,Unprovoked,USA," Daytona Beach, Volusia County",Surfing,M, 28,Right foot lacerated,N,08h00,1.2 m [4'] spinner shark
